-- phpMyAdmin SQL Dump
-- version 5.2.0
-- https://www.phpmyadmin.net/
--
-- Host: 127.0.0.1
-- Generation Time: Feb 16, 2023 at 02:57 PM
-- Server version: 10.4.24-MariaDB
-- PHP Version: 8.1.6

SET SQL_MODE = "NO_AUTO_VALUE_ON_ZERO";
START TRANSACTION;
SET time_zone = "+00:00";


/*!40101 SET @OLD_CHARACTER_SET_CLIENT=@@CHARACTER_SET_CLIENT */;
/*!40101 SET @OLD_CHARACTER_SET_RESULTS=@@CHARACTER_SET_RESULTS */;
/*!40101 SET @OLD_COLLATION_CONNECTION=@@COLLATION_CONNECTION */;
/*!40101 SET NAMES utf8mb4 */;

--
-- Database: `ctp_crm_developement`
--

-- --------------------------------------------------------

--
-- Table structure for table `clients`
--

CREATE TABLE `clients` (
  `id` bigint(20) UNSIGNED NOT NULL,
  `name` varchar(255) COLLATE utf8mb4_unicode_ci NOT NULL,
  `email` varchar(255) COLLATE utf8mb4_unicode_ci DEFAULT NULL,
  `phone` varchar(255) COLLATE utf8mb4_unicode_ci NOT NULL,
  `secondary_email` varchar(255) COLLATE utf8mb4_unicode_ci DEFAULT NULL,
  `secondary_phone` varchar(255) COLLATE utf8mb4_unicode_ci DEFAULT NULL,
  `company` varchar(255) COLLATE utf8mb4_unicode_ci DEFAULT NULL,
  `address` varchar(255) COLLATE utf8mb4_unicode_ci DEFAULT NULL,
  `note` text COLLATE utf8mb4_unicode_ci DEFAULT NULL,
  `photo` varchar(255) COLLATE utf8mb4_unicode_ci DEFAULT NULL,
  `status` varchar(255) COLLATE utf8mb4_unicode_ci NOT NULL DEFAULT 'lead',
  `created_at` timestamp NULL DEFAULT NULL,
  `updated_at` timestamp NULL DEFAULT NULL
) ENGINE=InnoDB DEFAULT CHARSET=utf8mb4 COLLATE=utf8mb4_unicode_ci;

--
-- Dumping data for table `clients`
--

INSERT INTO `clients` (`id`, `name`, `email`, `phone`, `secondary_email`, `secondary_phone`, `company`, `address`, `note`, `photo`, `status`, `created_at`, `updated_at`) VALUES
(1, 'Officia sunt nisi no', 'xakuwuzov@mailinator.com', '01752522545', 'jejafoc@mailinator.com', '01752522545', 'Sed cupiditate in qu', 'Pariatur A officia', 'Et dicta excepteur d', NULL, 'Proposal Sent', '2023-02-13 01:20:32', '2023-02-13 01:20:32'),
(2, 'Laboris cupiditate s', 'xakidanu@mailinator.com', '01755558545', 'veso@mailinator.com', '01755558545', 'Maxime non aliquam l', 'Assumenda voluptatem', 'Voluptas consequuntu', NULL, 'Proposal Sent', '2023-02-13 01:21:29', '2023-02-13 01:21:29'),
(8, 'Yamin Islam', 'reximecotextile@gmail.com', '01790222221', NULL, NULL, 'REXIM ECOTEXTILE INDUSTRIES LIMITED', 'Kazi Tower, Floor: 06 , Suite-6/C, Kuril Bishwaroad, Dhaka - 1229', 'Already reximecotextile.com and ktexbd.com 2i ta website order korse.. 2k taka pai onar kache.', NULL, 'Converted to Customer', '2021-02-08 09:19:34', '2021-02-11 07:05:41'),
(9, 'Zayan khan', 'zayn.khan0007@gmail.com', '01940096816', NULL, NULL, 'vaultmonarch.com', '98 boro magbazar , easter rokeya tower flat #1/601', NULL, NULL, 'Converted to Customer', '2021-02-08 20:08:09', '2021-02-08 20:08:09'),
(10, 'Rakesh saha', 'rakesh.saha@hams.com.bd', '01730304270', NULL, NULL, 'Hams Group', 'Block # F, House # 1, Road # 6,Niketon,', NULL, NULL, 'Converted to Customer', '2021-02-08 20:08:55', '2021-02-08 20:08:55'),
(11, 'Israt jahan diana', 'Isratjahandiana93@gmail.com', '01711585400', NULL, NULL, 'deshiolimited.com', '17/a(panna garden),road no 6,\r\nsekhertek shamoly housing Mohammadpur', NULL, NULL, 'Converted to Customer', '2021-02-08 20:11:21', '2021-02-08 20:11:21'),
(12, 'MR Nayem', 'techstreet.ltd@gmail.com', '01928011265', NULL, NULL, 'techstreet.ltd', 'H- 34, Rd No. 16 Nikunjo - 2', NULL, NULL, 'Converted to Customer', '2021-02-08 20:11:56', '2021-02-08 20:11:56'),
(13, 'zaheer khaled', 'zaheerkhaled@yahoo.com', '01710911288', NULL, NULL, 'BTAZ International Sourcing.', 'House # 27 Road # 15 Sector # 03\r\nUttara', NULL, NULL, 'Converted to Customer', '2021-02-08 20:12:24', '2021-02-08 20:12:48'),
(14, 'Md Mostafizur Rahman', 'admin@loyalarbitration.com', '01711085311', NULL, NULL, NULL, NULL, 'E-commerce/ BuySell Website Project Budget 30000 TK - 50000 TK,Sir kaj diea desa ono company.', NULL, 'Disqualified', '2021-02-08 20:14:27', '2022-06-01 04:00:27'),
(15, 'Ziko', 'ziko@partex.net', '01713479775', NULL, NULL, 'Agm it', '01713479775', 'Business Website.Proposal and Demo Sent.\r\n04.06.2022 onno protisthan theke niyese tai ar kono service apatoto lagbena . lagle janabe', NULL, 'Contacted', '2021-02-09 16:28:18', '2022-06-04 02:02:11'),
(16, 'shamsul huda', 'shamsul.bhuiyan@varnel.com.bd', '01844670388', NULL, '0244612501', 'baribhara.com.bd', 'Katabon, Dhaka', 'ecommerce website-proposal and damo sent', NULL, 'Converted to Customer', '2021-02-09 20:40:12', '2021-07-07 05:49:02'),
(17, 'Abdur Robe sir', 'rouf.mnupack@mnubd.com', '01713244026', NULL, NULL, NULL, NULL, 'ecommerce website and mobile basic apps proposal and damo sent.korabe na', NULL, 'Disqualified', '2021-02-09 20:44:30', '2022-06-01 04:07:49'),
(18, 'MD SUNBIR MOSTAFA', 'SUNBIR.MOSTAFA@GMAIL.COM', '01674493504', NULL, NULL, 'farzanaahmedbd.com', NULL, 'Corporate/ Company Website  10k Budget  Already developed and search engine optimized www.farzanaahmedbd.com need to be visually optimized with good appearance, sharp images and fonts, and pleasing color. This site has less than 10 static pages.\r\n\r\nour price is so much high', NULL, 'Disqualified', '2021-02-11 01:42:11', '2022-06-20 23:06:39'),
(19, 'Mizanur Rahman', 'sinthybusinessgroup@gmail.com', '01300683458', NULL, NULL, NULL, NULL, 'Corporate/ Company Website  10k budget  Propose company namae Chake free domino which name A&D soliution ltd A&D Corporation ltd A&D Development ltd. On point ltd. Oval solution ltd.', NULL, 'Disqualified', '2021-02-11 01:44:03', '2022-06-14 03:25:25'),
(20, 'Md Shohrab Hossain', 'shohrab@serac-bd.org', '01646678578', NULL, NULL, 'SERAC Bangladesh', 'C-4, House #140/141, Road #8, Block #B, Mirpur-12, Dhaka-1216', 'Nonprofit/ Foundation Website  Budget	200000 TK - 500000 TK    Dear Concern, Greetings from SERAC Bangladesh! Please send us a Quotation with an international feature for Conference Website. Looking forward to hearing from you soon.', NULL, 'Proposal Sent', '2021-02-11 01:51:12', '2022-06-21 00:40:02'),
(22, 'Mahmudul Hasan Rony', 'mhrony44@gmail.com', '01676527751', NULL, NULL, 'hisnhersbd.com', 'Permanent Address:Vill:Bhaor kot,P.O:Joyag,Upazilla:Sonaimuri,Noakhali', 'The E-commerce website, p 1 - 20000/=, 1k paid for Domain, rest of the advance will pay within 3 days.', NULL, 'Converted to Customer', '2021-02-12 21:10:11', '2021-02-13 02:26:44'),
(26, 'Arifur Rahman', 'ar944164@gmail.com', '01609082521', NULL, '01611595752', 'childnews.co.uk', NULL, 'Business website-Sir coming to evening time', NULL, 'Converted to Customer', '2021-02-13 16:16:38', '2021-07-07 06:06:34'),
(27, 'saad ibne abdul awaal', 'saad.ibneabdulawaal@gmail.com', '01772922085', NULL, NULL, 'asestechbd.com', '69, 71 New Elephant Rd,', NULL, NULL, 'Converted to Customer', '2021-02-13 16:27:09', '2021-02-13 21:59:58'),
(28, 'Tanveer H Chowdhury', 'chowdhurytanveerhossain@gmail.com', '+1(646)202-3622', NULL, NULL, NULL, NULL, 'USA theke contact korse new york theke onar ekta ecommece website lagbe.. onake proposal pathan then whatsapp e contact koren.. kaj diye dibe...\r\nyes sir i did a meeting through WhatsApp, and he tell me that he will work with us ,  within 2 days he will confirm that .', NULL, 'Converted to Customer', '2021-02-13 22:45:09', '2021-02-28 00:08:53'),
(29, 'SAMI', 'sitraders9994@gmail.com', '01608266631', NULL, NULL, NULL, NULL, 'Whatsapp e contact korse.. call dite dekhen ki chay... ecommerce website korabe..\r\n04.06.2022 Call receive korsena\r\n15.06.2022-kisudin por call dite hobe', NULL, 'Contacted', '2021-02-13 22:47:28', '2022-06-15 01:53:44'),
(30, 'Rupom Telecom Rajbari', 'ruomsheikh9@gmail.com', '01306086400', NULL, NULL, NULL, NULL, 'Looking for E-commerce/ BuySell Website Budget 10k\r\n04.06.2022 Number  off\r\n15.06.2022-Number off\r\n\r\nnot interested', NULL, 'Disqualified', '2021-02-16 21:13:10', '2022-06-15 01:55:21'),
(31, 'Russel Qurasishy', NULL, '01721404101', NULL, NULL, NULL, NULL, 'website form create korbe existing one e..pore kotha bolbe', NULL, 'Disqualified', '2021-02-16 21:18:53', '2022-06-01 04:08:22'),
(32, 'Doha Movers And Packers', NULL, '+97430300215', NULL, NULL, 'Dohamoversandpackers.com', NULL, 'Seo service nite chay moving service er jonno dohate tar business... Aikhane onk gula moving services ace jader website goggle top Ranking a ami amar website ante cai..\r\n04.06.2022 Call jaina\r\n\r\nprice is so much high.', NULL, 'Contacted', '2021-02-16 21:27:39', '2022-06-05 05:28:48'),
(33, 'Juned Nurani', 'junednurani@hotmail.com', '+447869108549', NULL, NULL, NULL, NULL, 'Ecommerce website korabe ami 25 bole disi... onake sob demo o mail kore disi already... whats app e contact koren..', NULL, 'Disqualified', '2021-02-16 21:38:42', '2022-06-19 21:20:43'),
(34, 'SHOHID', NULL, '+97336933790', NULL, NULL, NULL, NULL, 'Whatsapp e contact korse..\r\n04.06.2022 Call duksena\r\n15.06.2022-Call dukena', NULL, 'Disqualified', '2021-02-16 21:40:26', '2022-06-15 01:55:58'),
(35, 'Sujan Husan', 'sujanhusan@gmail.com', '01976399333', NULL, NULL, NULL, NULL, 'business website korbe.. electronics er dokan er jonno... proposal pathan then phn din...', NULL, 'Contacted', '2021-02-17 02:50:51', '2022-06-05 05:29:26'),
(36, 'Md Monir sir', 'info@udceducation.com', '01975940077', NULL, NULL, 'Unique Dream Consultant', 'sonike kalab,house-86,Aminabuban 3th floor,new air port road.', NULL, NULL, 'Qualified', '2021-02-17 03:09:54', '2021-07-07 06:28:46'),
(37, 'Ashiqur Rahman', 'reson63@gmail.com', '01612730004', NULL, NULL, NULL, NULL, 'ecommerce website  no response', NULL, 'Disqualified', '2021-02-17 23:33:31', '2022-05-30 22:21:05'),
(39, 'Santo Khan', NULL, '01970345701', NULL, '01788160711', NULL, NULL, 'https:// / etar moto news portal korbe...\r\n04.06.2022 Monday office a asbe. News Portal website banabe\r\n\r\n2 number website', NULL, 'Contacted', '2021-02-19 21:39:58', '2022-06-04 01:41:59'),
(40, 'Unknown', NULL, '01870035894', NULL, NULL, NULL, NULL, 'No Response\r\n04.06.2022  gosol korse ,pore abar call korte hobe', NULL, 'Contacted', '2021-02-19 21:46:41', '2022-06-05 04:35:17'),
(41, 'Ejaz Rasul', 'ejazrasul2007@yahoo.com', '01817079641', NULL, NULL, 'Padma Oxygen Limited', 'House 11, Road 9, Block C, Section 6, Mirpur', NULL, NULL, 'Converted to Customer', '2021-02-19 21:50:19', '2021-02-26 18:15:45'),
(42, 'oian sir', NULL, '01813763009', NULL, '01650076386', NULL, NULL, NULL, NULL, 'Converted to Customer', '2021-02-20 00:46:08', '2021-02-22 17:05:45'),
(43, 'Kapil sir', 'kapildeb1992@gmail.com', '01642839486', NULL, NULL, 'Point of traint textile', 'Gulshan-1,Road-8,Bwd12/A,', 'photo graphy and graphichDesign and business website', NULL, 'Disqualified', '2021-02-20 00:53:40', '2022-06-01 04:09:29'),
(44, 'Md Monir Hossain', 'rizvifruitsltd@gmail.com', '01713013763', NULL, NULL, 'Rizvi Fruits Limited', '16/B Ahsanullah Road ,Badamtoli ,Dhaka -1100', 'Business Website-Package-3', NULL, 'Converted to Customer', '2021-02-20 00:57:28', '2021-07-07 05:25:09'),
(45, 'Khan Farhan Abir', 'khanfarhanabir44@gmail.com', '01824276161', NULL, NULL, NULL, NULL, 'requirement mail forward korsi.. mustakim@creativetechpark.com delivery system lagbe onar...\r\n04.06.2022 mobile off \r\n15.06.2022-Mobile Off\r\n\r\n\r\nit was my mistake', NULL, 'Disqualified', '2021-02-20 01:45:34', '2022-06-15 01:57:13'),
(46, 'Md Tazbir Hosan', 'cleaningcs1997@gmail.com', '01617622444', NULL, NULL, NULL, NULL, 'Business Website pakage-1-13000\r\nCleaning er upor jodi kono demo thake pathate bolesen', NULL, 'Contacted', '2021-02-20 02:16:52', '2022-06-03 22:36:37'),
(47, 'unknown', NULL, '01911359627', NULL, NULL, NULL, NULL, 'Korba Pora janaba\r\n04.06.2022 ekhon korte chaina .pore nujerai amader sathe jugajug korbe', NULL, 'Contacted', '2021-02-20 02:18:31', '2022-06-03 22:24:20'),
(48, 'julhas sir', 'julhas86miah@gmail.com', '01821666027', NULL, '01316445018', NULL, NULL, 'laravel multivandor covide -19\r\n04.06.2022 Call Receive korsena.\r\n15.06.2022-SEO ta korate chai ,package pathate hobe Pathalam', NULL, 'Proposal Sent', '2021-02-20 02:31:10', '2022-06-15 02:14:07'),
(49, 'Surja Mandal', 'surjamandal032@gmail.com', '01409770784', NULL, NULL, NULL, NULL, 'Ecommerce website korabe... facebook e knock korse..\r\n\\  number off\r\n\r\n\r\n\r\nnumber offf', NULL, 'Disqualified', '2021-02-20 08:41:31', '2022-06-01 04:09:55'),
(50, 'Olid', NULL, '01874955872', NULL, NULL, NULL, NULL, 'Whatsapp e knock korse..\r\nhacking\r\n04.06.2022 Call Receive korsena.', NULL, 'Contacted', '2021-02-21 05:54:49', '2022-06-05 05:30:28'),
(51, 'Rumun', NULL, '0 1314468492', NULL, NULL, NULL, NULL, 'Whatsapp e contact korse..\r\n04.06.2022 Call Receive korsena.\r\n15.06.2022 Call Receive korsena.', NULL, 'Disqualified', '2021-02-21 05:57:16', '2022-06-15 02:22:55'),
(52, 'Faysal Sir', 'operations.btta@gmail.com', '01713078746', NULL, NULL, 'B.T.Tex Access', 'House-205,Level-2,Road-worldise Relget,Mogbazar Dhaka-1215.', 'business website and grapise,Silader,Category Graphics Design', NULL, 'Disqualified', '2021-02-21 16:49:27', '2022-06-01 04:10:22'),
(53, 'shajib khandkur sir', NULL, '01310830135', NULL, NULL, NULL, NULL, 'Ecommerce Website,Pakage-1\r\n04.06.2022 onek besto pore abar call dite hobe', NULL, 'Contacted', '2021-02-21 16:52:37', '2022-06-03 22:14:47'),
(54, 'Shamim Zaman', 'msu.zaman25685@gmail.com', '01762208906', NULL, NULL, NULL, NULL, 'I need a fully professional e-commerce website as like as Amazon (in future).\r\n\r\nPls let me know detail.\r\nAlso pls share your demmo.\r\n\r\nPlease select an interesting name for \"SZ\" e.g, SZ Mart etc.\r\n\r\nWould appreciate your prompt reply.', NULL, 'Converted to Customer', '2021-02-21 22:56:26', '2021-02-24 00:37:53'),
(55, 'Sahidul Islam Rokib', 'rahib131011511@gmail.com', '01644930937', NULL, NULL, NULL, NULL, 'Will come to our office 25 February 3 pm .korabe na', NULL, 'Disqualified', '2021-02-21 23:27:42', '2022-06-01 05:30:29'),
(56, 'MD Shakendar', 'mdshakender@gmail.com', '01788559445', NULL, NULL, '3rd vision interior', NULL, 'website redesign korabbe.. interior design website... social media gula add kore dite hobe... like fb linkdin twitter youtube.. etc.. amader proposal pathan... then phn din...  phn diye email and website link chan.. if  need he  will call me', NULL, 'Disqualified', '2021-02-22 00:30:36', '2022-06-05 01:20:48'),
(57, 'Unknown', NULL, '01841243383', NULL, NULL, NULL, NULL, 'Dhanmondi theke ei mohila phn korse.. oni ekta website design korate chay.. onake office address text kora hoise..  onake phn diye email collect kore then proposal pathan..no response', NULL, 'Disqualified', '2021-02-22 03:48:53', '2022-06-04 21:56:07'),
(58, 'Mosharraf Hossain', 'mosharraf017178@gmail.com', '01771853797', NULL, '01713-002912', 'S.Rana Trading International', 'House No. 35/D, 1st Floor, Road No. 07, Block G, Banani, Dhaka- 1213, Bangladesh', 'Manpower Recruiting Agency er jonno business website create korbe..\r\n04.06.2022 ei muhurte kono service lagbena .tobe kono service lagle obossoy amk janaben', NULL, 'Contacted', '2021-02-23 00:06:07', '2022-06-03 22:05:58'),
(59, 'Arif Ullah', NULL, '01973650360', NULL, NULL, NULL, NULL, 'dupur 12 tay phn dise..\r\ncandidet\r\n04.06.2022 Mobile ta basai rekhe giyese.', NULL, 'Contacted', '2021-02-23 23:01:09', '2022-06-03 21:54:15'),
(60, 'unknown', NULL, '01716428790', NULL, NULL, NULL, NULL, 'https://classified2.ctpbd.com/\r\nbikroy er moto site Korte chay.. need to call 22.01.21', NULL, 'Disqualified', '2021-02-24 02:05:29', '2022-06-04 21:56:21'),
(61, 'trijit dhar', 'trijit@uap-bd.edu', '01933104590', NULL, NULL, NULL, NULL, 'AP website design packages sent... taj\r\nhis boss in in abroad , after 12 days tell me to again call , boss come back to dhaka bt need time .', NULL, 'Disqualified', '2021-02-24 02:23:05', '2022-06-05 01:20:59'),
(62, 'Wahid Ibn Ahsan', 'multitech.sales01@gmail.com', '1675844191', NULL, NULL, 'Multitech International', NULL, 'quotation sent, he is talking with his boss, possibility to give work order  January first week, he is out of Dhaka, tell me to call 12.01.21, fix meeting 17.01.21 at 11 am, meeting done, need 10 days  to manage data', NULL, 'Disqualified', '2021-02-24 02:24:27', '2022-06-05 01:21:15'),
(63, 'Md. Abdul Karim Raju', NULL, '01838832192', NULL, NULL, 'Globe Pharmaceuticals Group of Companies Ltd.', NULL, 'proposal sent  , he will forward mail to his boos and they will arrange meeting with us soon , \r\nmeeting also done', NULL, 'Disqualified', '2021-02-24 02:25:31', '2022-06-21 00:54:09'),
(64, 'Jakir Hossain', 'mab_2003@yahoo.com', '01713841145', 'dr.institute@yahoo.com', NULL, 'mab', NULL, 'Liberty Foundation', NULL, 'Disqualified', '2021-02-24 02:27:04', '2022-06-21 00:55:12'),
(65, 'aaa', 'ebfashion02@gmail.com', '01731372788', NULL, NULL, 'ebfashion', NULL, 'website redesign korabe..pac 1 , 12000=/ number off', NULL, 'Disqualified', '2021-02-24 02:28:00', '2022-06-05 01:58:18'),
(66, 'ripon', 'shezonripon@gmail.com', '01643522836', NULL, '01403294071', NULL, NULL, 'website and software', NULL, 'Disqualified', '2021-02-24 02:28:58', '2022-06-21 00:49:10'),
(67, 'mahtab', 'eco.mahatab@gmail.com', '01670736701', NULL, NULL, NULL, NULL, 'website design \r\ncame our office, need time to confirm with his MD sir', NULL, 'Disqualified', '2021-02-24 02:30:05', '2022-06-21 00:57:15'),
(68, 'Rahman Mizan', 'mzrsunny@gmail.com', '01707002001', NULL, NULL, NULL, NULL, 'looking for app and web Design developer .....\r\npossitive , he already sent all the information', NULL, 'Disqualified', '2021-02-24 02:31:38', '2022-06-21 01:07:08'),
(69, 'ncccul', 'ncccul.it@gmail.com', '01708056578', NULL, NULL, NULL, NULL, 'call not received', NULL, 'Disqualified', '2021-02-24 02:32:36', '2022-06-05 02:15:33'),
(70, 'aaa', 'mursel@msn.com', '01832854408', NULL, NULL, NULL, NULL, 'website design', NULL, 'Disqualified', '2021-02-24 02:33:30', '2022-05-31 04:01:04'),
(71, 'mahmudul hasan', NULL, '01811487951', NULL, NULL, 'Amin mohammad group', NULL, 'nest week , boss is in abrode', NULL, 'Contacted', '2021-02-24 02:35:03', '2022-06-21 01:18:30'),
(72, 'moynul islam', NULL, '01920469599', NULL, NULL, NULL, NULL, '--- website design...need time to take the decision', NULL, 'lead', '2021-02-24 02:38:56', '2022-03-03 03:26:56'),
(73, 'Afzal hossain', 'info.kentbangladesh@gmail.com', '01787678948', NULL, '0 1993779999', 'Kent Bangladesh', 'Dhaka Bangladesh', 'kenthoker/kentmerchant/kentsolution.com\r\nhe is suddenly being busy today, tell me to call tomorrow before 10 am\r\npositive, he will work this month kint', NULL, 'Converted to Customer', '2021-02-24 02:46:40', '2021-07-07 05:55:31'),
(74, 'Hasnine Fahim', 'megatechdhaka.gnbd@gmail.com', '01554688845', 'megatech.oilngasdivision@gmail.com', NULL, 'Megatech  GNBD', NULL, 'business website pakage-1-12ooo,Page Extra-2', NULL, 'Quote Sent', '2021-02-24 19:17:26', '2021-02-24 19:17:26'),
(75, 'hasan', 'hasanbd1966@gmail.com', '01758943899', NULL, NULL, 'export business', NULL, 'export business er website', NULL, 'lead', '2021-02-24 20:39:55', '2022-03-03 03:26:56'),
(76, 'mahir', 'mahiranisuzzaman@gmail.com', '1739494575', NULL, NULL, NULL, NULL, 'Corporate/ Company Website 10000 TK\r\npositive, need time to get confirmation from his elder one', NULL, 'lead', '2021-02-24 20:42:24', '2022-06-19 02:37:10'),
(77, 'Rupu Rayhan', 'rupu.rayhan@yahoo.com', '+447405793546', NULL, NULL, NULL, NULL, 'This is WhatsApp number: +447405793546 Requirement mail forward kore disi..', NULL, 'Disqualified', '2021-02-24 21:06:21', '2022-06-19 21:13:42'),
(78, 'Unknown', NULL, '01715411709', NULL, NULL, NULL, NULL, 'Call diye identify korun .. ar website design er jonno phn diyece..\r\nno interested now\r\n04.06.2022 Call Receive korsena.', NULL, 'Contacted', '2021-02-25 10:11:04', '2022-06-05 05:31:09'),
(79, 'sabrina', NULL, '01770791977', NULL, NULL, NULL, NULL, '14 tarikh phn diyece number off\r\n\r\npromotion company', NULL, 'Disqualified', '2021-02-25 10:12:03', '2022-06-05 02:15:43'),
(80, 'Fuad', NULL, '01813678774', NULL, NULL, 'Gallery Bangladesh', NULL, NULL, NULL, 'Disqualified', '2021-02-25 10:15:26', '2022-06-21 01:39:56'),
(81, 'Unknown', NULL, '01609564224', NULL, NULL, NULL, NULL, '16 tarikh phn dise\r\n\r\nwork started before 1 week', NULL, 'Contacted', '2021-02-25 10:20:10', '2022-06-05 05:31:35'),
(82, 'Rafikul islam', NULL, '01915400598', NULL, NULL, NULL, NULL, '19 tarikh phn dise..\r\nhe came to our office just for information', NULL, 'Disqualified', '2021-02-25 10:23:14', '2022-06-21 01:55:51'),
(83, 'Unknown', NULL, '01970741882', NULL, NULL, NULL, NULL, '19 tarikh phn dise . no answer number off', NULL, 'Disqualified', '2021-02-25 10:25:59', '2022-06-04 21:56:34'),
(84, 'Unknown', NULL, '01715028779', NULL, NULL, NULL, NULL, '21 tarikh phn die\r\n\r\nmoja nite ohone dise', NULL, 'Disqualified', '2021-02-25 10:28:22', '2022-06-19 22:00:18'),
(85, 'Uk client', NULL, '+447873055393', NULL, NULL, NULL, NULL, 'Contact whatsapp--', NULL, 'Disqualified', '2021-02-25 10:30:50', '2022-06-19 21:20:58'),
(86, 'Unknown', NULL, '01768483313', NULL, NULL, NULL, NULL, '25 tarikh phn dise\r\n\r\njob candidate', NULL, 'Disqualified', '2021-02-25 10:32:07', '2022-06-19 22:00:30'),
(87, 'Asif sir', 'mithunasif312@gmail.com', '01711706160', NULL, NULL, NULL, NULL, 'Business website-lawyer', NULL, 'Proposal Sent', '2021-02-26 01:03:31', '2021-03-06 18:03:57'),
(88, 'unknown', 'litontoronto@gmail.com', '01992821686', NULL, NULL, NULL, NULL, 'chain hotel website number invalid', NULL, 'Disqualified', '2021-02-26 21:41:23', '2022-06-04 21:56:45'),
(89, 'Isabella', 'rosepastry13@gmail.com', '01727508766', NULL, NULL, 'Rose Pastry', NULL, 'PreOrder System & course Enroll System', NULL, 'Qualified', '2021-02-26 21:57:35', '2021-04-26 21:55:13'),
(90, 'Mostafiju Rohman', NULL, '01811699722', NULL, NULL, NULL, NULL, 'Android and IOS -quotation pathabo', NULL, 'Disqualified', '2021-02-26 21:59:03', '2022-06-21 01:25:32'),
(91, 'Munir Hassan Mithu', 'mithu@appareltodayIimited.com.bd', '01615153724', NULL, NULL, 'apparel today', 'Gohailbari,Machinepar, Shimulia,Ashulia, Savar, Dhaka', NULL, NULL, 'Converted to Customer', '2021-02-27 00:39:48', '2021-05-02 00:39:47'),
(92, 'Anisuzzaman Mahir', 'mahiranisuzzaman@gmail.com', '01739494575', NULL, NULL, 'export business', NULL, 'Corporate/ Company Website 10000 TK\r\npositive, need time to get confirmation from his elder one', NULL, 'lead', '2021-02-27 00:50:56', '2022-03-03 03:26:56'),
(93, 'Md.Obaidur Rahman', 'pstsalman@gmail.com', '01740363361', NULL, NULL, 'mfasto.com', 'Dhaka-Raipur road', 'eCommerce website', NULL, 'Converted to Customer', '2021-02-27 00:54:11', '2021-07-07 05:23:17'),
(95, 'The Daly Morning', 'morningexpressbd@gmail.com', '01718742223', NULL, NULL, 'The daly Morning Experse', '54 Motizal 6th floor Dhaka-1000', 'Ecommerce website\r\n15.06.2022 Number Off', NULL, 'Disqualified', '2021-03-01 16:33:26', '2022-06-15 02:28:24'),
(96, 'Gias Uddin', 'gias.digitech@gmail.com', '01711562143', NULL, NULL, 'Digitech(Domain and Hosting) Have', 'Meheraba Plaza(Gr.Fl.)33TopKhana Road Dhaka-1000', 'Ecommerch website(Pakage-2)', NULL, 'Converted to Customer', '2021-03-02 16:26:00', '2021-03-03 01:35:24'),
(97, 'Tanjina akther', 'tanjinaakther072@gmail.com', '01748280867', NULL, NULL, NULL, NULL, 'Looking fo E-commerce/ BuySell Website  Low budget\r\nstudent\r\n15.06.2022 Call Receive korsena.\r\n18.06.2022-receive korena', NULL, 'Disqualified', '2021-03-03 01:20:50', '2022-06-18 01:13:08'),
(98, 'Fahim', NULL, '01793172115', NULL, NULL, NULL, NULL, 'Mobile app korabe', NULL, 'Contacted', '2021-03-03 01:28:02', '2022-06-05 05:32:40'),
(99, 'Noushin Tarannum', NULL, '01313768360', NULL, NULL, NULL, NULL, 'student `\r\n15.06.2022 Number Off thake', NULL, 'Disqualified', '2021-03-03 01:30:28', '2022-06-15 02:32:14'),
(100, 'Unknown', NULL, '0248961831', NULL, NULL, NULL, NULL, 'Ecommerce \r\n15.06.2022 Call Receive korsena.', NULL, 'Disqualified', '2021-03-03 01:31:38', '2022-06-15 03:08:46'),
(101, 'Unknown', NULL, '01756204446', NULL, NULL, NULL, NULL, '18.06.2022-Number Off', NULL, 'Disqualified', '2021-03-03 04:01:08', '2022-06-18 01:11:21'),
(102, 'Sayem Hossain', 'musayem@gmail.com', '+61401761595', NULL, NULL, 'Graduate School of Management Brac University', '66 Mohakhali, Dhaka 1212, Bangladesh', 'Contact Whatsapp\r\nI am based in Australia now, so my address and no. will not be of any use. I want to create a website like this - https://www.sasin.edu/\r\nCan you do it?\r\nMy time is 5 hrs plus than bd time. So better not call me after evening', NULL, 'Disqualified', '2021-03-03 04:09:00', '2022-06-05 21:56:06'),
(103, 'Jahirul Islam', 'jahir@uca.edu.bd', '01979901699', NULL, NULL, NULL, 'United College of Aviation, Science & Management House-16, Road-04, Sector-03, Uttara, Dhaka.', 'mail forward korsi apnake. \r\nwe want to create an e-learning website where anyone can upload the courses and anybody can learn or download. hope you understand. so that please send me your company profile and also proposal.', NULL, 'Disqualified', '2021-03-03 09:03:07', '2022-06-05 22:02:35'),
(104, 'mehidi', 'mdmehhediislam2016@gmail.com', '01831421681', NULL, NULL, NULL, NULL, 'ecommerce website. 1 week por calll dibo. number invalid', NULL, 'Disqualified', '2021-03-03 23:51:51', '2022-06-05 22:04:31'),
(105, 'Mehedi Ecommerce', 'mdmehediislam2021@gmail.com', '01757210455', NULL, NULL, NULL, NULL, '[6:35 PM, 3/4/2021] +880 1757-210455: I want to make s e-commerce website my requirement is\r\nhis partner covid effected \r\n1.Two Phone Number \r\n2.Two Email Account \r\n3. Colour selection \r\n4.size selection \r\nAnd Quantity selection \r\nMy E-Commerece products is\r\na.Home textile \r\nb.Home appliance \r\nc. All types of readymade garments dress like boyes girls kids\r\n[6:36 PM, 3/4/2021] +880 1757-210455: So how much prices need to me??', NULL, 'Contacted', '2021-03-04 00:47:05', '2022-06-05 05:33:44'),
(106, 'school', NULL, '01829729915', NULL, NULL, NULL, NULL, 'school er website banae... demo website pathabe....', NULL, 'Disqualified', '2021-03-04 01:11:43', '2022-06-05 22:04:14'),
(107, 'website', NULL, '01982488202', NULL, NULL, NULL, NULL, 'very much positive,website - Next month 1st week pore call dibe', NULL, 'Disqualified', '2021-03-04 01:12:53', '2022-06-18 04:49:22'),
(108, 'zahid hasan', 'z.khandoker35@gmail.com', '01620647878', NULL, NULL, NULL, NULL, 'website design package 1 low price e Korte chay, I told 11000 no response', NULL, 'Disqualified', '2021-03-04 01:13:45', '2022-06-06 04:12:31'),
(109, 'syedq', 'syedq.minds@gmail.com', '01300378324', NULL, NULL, NULL, NULL, 'Corporate/ Company Website  15000 TK - 20000 TK number off', NULL, 'Disqualified', '2021-03-04 01:14:52', '2022-06-05 22:07:46'),
(110, 'unknown', 'bdconquest@gmail.com', '01798212151', NULL, NULL, NULL, NULL, 'Corporate/ Company Website  Less Than 10000 TK', NULL, 'Disqualified', '2021-03-04 01:15:43', '2022-06-04 22:12:13'),
(111, 'rejaul Alom', NULL, '01710330756', NULL, NULL, NULL, NULL, 'will start new number off', NULL, 'Disqualified', '2021-03-04 01:20:58', '2022-06-15 01:42:22'),
(112, 'Hasan Tanveer', 'tanveer115117@gmail.com', '01676349038', NULL, NULL, NULL, NULL, '250k quote korben..\r\nneed a quotation for building an app\r\n[11:14 PM, 3/5/2021] +880 1676-349038: need to develop a restaurant booking app. Customers will get a voucher after booking\r\n[11:15 PM, 3/5/2021] +880 1676-349038: Restaurants owners can put discounts on their menu\r\n[11:15 PM, 3/5/2021] +880 1676-349038: I can help with making the icon, app flow diagram and UI sketch\r\n[11:15 PM, 3/5/2021] +880 1676-349038: I want to do it on flutter\r\n[11:15 PM, 3/5/2021] +880 1676-349038: Email: tanveer115117@gmail.com\r\nno response', NULL, 'Disqualified', '2021-03-05 06:15:08', '2022-06-15 01:47:45'),
(113, 'unknown', 'tutulmy@gmail.com', '01914225356', NULL, NULL, NULL, 'House-cwna,3b Road-49,Gulshan-2', 'Ecommrece website\r\n18.06.2022-Onno protisthan theke niyese.', NULL, 'Contacted', '2021-03-05 20:30:24', '2022-06-18 01:10:22'),
(114, 'MD. Mahir (ROAR Retail)', 'roarretail787@gmail.com', '01705043605', NULL, NULL, 'ROAR Retail', NULL, 'ROAR Retail er Jonno eCommerce website korabe p3 diben.. all payment gateway integration hobe..', NULL, 'Disqualified', '2021-03-06 00:51:58', '2022-06-15 01:48:14'),
(115, 'Unknown', NULL, '+19292182658', NULL, NULL, NULL, NULL, '18.06.2022-Invelid number', NULL, 'Disqualified', '2021-03-06 00:53:35', '2022-06-18 01:08:20'),
(116, 'Unknown  deliver', NULL, '01786306564', NULL, NULL, NULL, NULL, 'already given to another company', NULL, 'Contacted', '2021-03-06 00:59:23', '2022-06-05 05:34:39'),
(117, 'Sadia Sunny', 'dollhousejewelryusa11@gmail.com', '+19293953013', NULL, NULL, 'Dollhouse Jewelry', '32-14 30th street Astoria 1st floor zip 11106 New York', 'Package 2 nibe.. ekhn only tk send korbe.. kuno discount dei nai.. call kore kore tk chan.. already system e registration o kore disi.. domain name ta confirm korben...', NULL, 'Disqualified', '2021-03-06 01:06:49', '2022-06-15 01:54:23'),
(118, 'Mehedi', 'mtbabo57@gmail.com', '01798717185', NULL, NULL, NULL, NULL, 'website design korate chay.. proposal sent kore confirm koren..\r\nstudent', NULL, 'Contacted', '2021-03-06 03:16:03', '2022-06-05 05:35:04'),
(119, 'MD Iqbal Khan', 'mohammadiqbalkhan@gmail.com', '01755525586', NULL, NULL, NULL, NULL, 'proposal pathate hobe -Android APPS-W0RD PRESS', NULL, 'Contacted', '2021-03-06 03:18:24', '2022-06-05 05:35:29'),
(120, 'Imtiaj', 'imtiaz.ogl@gmail.com', '01708462263', NULL, NULL, NULL, NULL, 'Ecommerce Website', NULL, 'Disqualified', '2021-03-06 18:08:35', '2022-06-18 04:27:31'),
(121, 'Roman Raihan', 'roman@icreation.com.bd', '01711589987', NULL, NULL, 'I Creation Ltd.', 'ABC Spring Flower, House 52, Road 02, Banani, Dhaka 1213', 'Quotation for an E-commerce website ( laravel and customize) ( android & IOS) Design and Development.', NULL, 'Contacted', '2021-03-06 18:17:42', '2022-06-05 05:36:29'),
(122, 'Asif sir', 'asifahmedfahim32207@gmail.com', '01787386534', NULL, NULL, NULL, NULL, 'business website-mongol bar asba. Hostpital serial apps. korabe na', NULL, 'Disqualified', '2021-03-07 16:27:01', '2022-05-31 04:28:14'),
(123, 'unknown', NULL, '01714325325', NULL, NULL, NULL, NULL, 'goole map intergation', NULL, 'Contacted', '2021-03-07 16:29:32', '2022-06-05 05:37:08'),
(124, 'MD Khayrul Baser', 'smartbaser@gmail.com', '01979215338', 'pinkyeco@gmail.com', '01928646134', 'Smart Distribution (pvt) ltd', '129 New Eskaton Road, Eskaton Tower (2nd Floor), Ramna', NULL, NULL, 'Converted to Customer', '2021-03-07 19:14:10', '2021-03-14 00:40:30'),
(125, 'Asikur Rahman', 'mdshaon141@gmail.com', '01787081119', NULL, NULL, NULL, NULL, 'business website', NULL, 'Disqualified', '2021-03-07 21:35:33', '2022-06-15 01:53:56'),
(126, 'Abc sufan sir', 'abcsufian@gmail.com', '01714066243', NULL, NULL, 'TEXT 1971', 'House-2,(Level-4),Road-02,Gudara Ghat,Gulshan,Badda Link Road,Gulshan-01,Dhaka-1212', 'busnis website', NULL, 'Converted to Customer', '2021-03-09 16:13:54', '2021-07-07 07:19:46'),
(127, 'Rajun sir', 'rajon@dadadhaka.com', '01717057866', NULL, NULL, NULL, NULL, 'Busniess website', NULL, 'Contacted', '2021-03-10 20:11:48', '2022-06-05 05:37:36'),
(128, 'unknown', 'alim.babu54@gmail.com', '01869347047', NULL, NULL, 'unknown', NULL, 'He will Create Business website . 13/03/2021 Called him, He is interested. Will work next month number off', NULL, 'Disqualified', '2021-03-14 01:00:33', '2022-06-05 01:58:33'),
(129, 'Yemen hasan', 'yemen9016@gmail.com', '01919789016', NULL, NULL, 'Yemen Shop', NULL, 'Ecommerce website. Interested . Need redesign for yemenbd.com', NULL, 'Disqualified', '2021-03-14 01:03:42', '2022-06-15 01:57:54'),
(130, 'Johir Uddin Titu', NULL, '01882140021', NULL, NULL, 'Hotel Affad Inn.', NULL, 'Will create a website for Hotel.number off', NULL, 'Disqualified', '2021-03-14 01:07:21', '2022-06-18 04:49:04'),
(131, 'hanifizjaman', NULL, '01674684559', NULL, NULL, NULL, NULL, '2 website, I will talk to him after 1 month. not recived. if need he will call me.', NULL, 'Disqualified', '2021-03-14 01:16:41', '2022-06-18 04:29:27'),
(132, 'Hasan', 'ahsanul_eel@esquirebd.com', '01709636141', NULL, NULL, 'esqure electronics', NULL, 'Website complete . G sutite proposal sent. I will call him for g suite. G-Suite interested. Call him next. pore call dibe', NULL, 'Disqualified', '2021-03-14 01:19:22', '2022-06-18 04:27:24'),
(133, 'unknown', NULL, '01755606109', NULL, NULL, NULL, NULL, 'if need,,he will call me. website done by others', NULL, 'Disqualified', '2021-03-14 01:22:09', '2022-06-05 01:59:01'),
(134, 'Rony tanvir moon', NULL, '01728946020', NULL, NULL, NULL, NULL, 'will create ecommerce website.  Call after  1 Hour. Call not recived.', NULL, 'Disqualified', '2021-03-14 01:26:41', '2022-06-18 01:38:32'),
(135, 'jakaria', NULL, '01716746539', NULL, NULL, NULL, NULL, 'website design. Not recived. not interested', NULL, 'Disqualified', '2021-03-14 01:27:48', '2022-06-18 03:49:35'),
(136, 'unknown', NULL, '01319801958', NULL, NULL, NULL, NULL, 'delivery website. He is busy, number off', NULL, 'Disqualified', '2021-03-14 01:28:45', '2022-06-05 01:59:09'),
(137, 'aktaruzzaman', 'bidduth317@gmail.com', '01773212427', NULL, NULL, NULL, NULL, 'Tution website. Need to send proposal . proposal send done. pore jogajog korbe. quotation send. number off', NULL, 'Disqualified', '2021-03-14 01:29:40', '2022-05-31 04:03:07'),
(138, 'Unknown', 'alam_ena@gmail.com', '01941678681', NULL, NULL, NULL, NULL, 'ecommerce korate chay.. package 1 --Proposal sent-', NULL, 'Contacted', '2021-03-14 02:47:06', '2022-06-05 05:38:03'),
(139, 'shohag', 'shohag.it@galaxybd.com', '01777763881', NULL, NULL, NULL, NULL, 'website design proposal sent  quater airways er official agent ora.. corporate website banabe....call not recceived', NULL, 'Contacted', '2021-03-14 02:48:10', '2022-06-05 05:38:31'),
(140, 'Mohammad Sohag', 'maplawbd@gmail.com', '01741448244', NULL, NULL, NULL, NULL, 'Looking for	Corporate/ Company Website\r\nBudget 10k \r\nI have been looking for a Web Developer who will handle all my website and mailing related issues for my new Law firm. To be more specific, I need service like domain buying, hosting, website design and development. If interested, please email me your quotation and link of your previous experience of any law firm website development. Thanks in advance, Mohammad Sohag Corp Lawyer', NULL, 'Disqualified', '2021-03-14 10:40:00', '2022-06-18 04:06:50'),
(141, 'Unknown', NULL, '01924898137', NULL, '01614898137', NULL, NULL, 'He need a bulk sms apps.He will call us soon.', NULL, 'Contacted', '2021-03-14 17:13:39', '2022-06-05 05:39:01'),
(142, 'Unknown', 'forhad@nclbd.net', '01797184157', NULL, NULL, NULL, NULL, 'App development Proposal Sent.', NULL, 'Disqualified', '2021-03-14 17:19:38', '2022-06-04 22:12:49'),
(143, 'Unknown', NULL, '01886550000', NULL, NULL, NULL, NULL, 'business website korabe.. ..Pore Korabe..jkhn need hbe he will call us', NULL, 'Disqualified', '2021-03-14 17:34:47', '2022-06-21 04:02:59'),
(144, 'Eshak', 'eshakuddin123@gmail.com', '01991398026', NULL, NULL, NULL, NULL, 'ecommerce website korbe, kichu din por amader knock korbe.. 31/03/2021--Phone Not recived', NULL, 'Disqualified', '2021-03-14 17:35:05', '2022-06-18 01:38:07'),
(145, 'unknown', 'it@spacebd.biz', '01611026594', NULL, NULL, 'spacebd.biz', NULL, 'Busy, Next time call him website done by other', NULL, 'Disqualified', '2021-03-14 17:42:00', '2022-06-05 01:59:20'),
(146, 'unknown', 'jamanmunir@yahoo.com', '01841340787', NULL, NULL, NULL, NULL, 'kaj  kore felse', NULL, 'Disqualified', '2021-03-14 17:45:47', '2022-06-05 01:59:29'),
(147, 'mehedi', 'mehedi.d16@gmail.com', '01833155334', NULL, NULL, NULL, NULL, 'mumber offf', NULL, 'Disqualified', '2021-03-14 18:01:51', '2022-06-18 04:05:14'),
(148, 'sumon sajjad', NULL, '01917608330', NULL, NULL, 'https://shahojia.com/', NULL, 'website complete by others company, so i knock him next time for seo. not interested', NULL, 'Disqualified', '2021-03-14 18:05:56', '2022-06-18 01:43:17'),
(149, 'Saad Nasim', 'nasim@creativetechpark.com', '01989230820', NULL, NULL, NULL, NULL, 'TEST\r\n18.06.2022-amader Employee', NULL, 'Disqualified', '2021-03-14 18:10:02', '2022-06-18 01:06:24'),
(150, 'Jakir', 'jakir@creativetechpark.com', '01703908890', NULL, NULL, NULL, NULL, NULL, NULL, 'lead', '2021-03-14 18:30:48', '2022-06-19 02:37:10'),
(151, 'Shifat M. Sadiq', NULL, '01732694156', NULL, NULL, NULL, NULL, 'e-commerce, phone not recived', NULL, 'Disqualified', '2021-03-14 21:11:15', '2022-06-18 04:48:34'),
(152, 'mashud parvej', 'mashudparvejechowdhury@gmail.com', '01670979740', NULL, NULL, 'bank asia', NULL, 'website, Phone not recived.. not interested', NULL, 'Disqualified', '2021-03-14 21:16:40', '2022-06-18 04:27:45'),
(153, 'unknown', NULL, '01733588444', NULL, NULL, NULL, NULL, 'http://texdealinc.com.bd/ eta redesign korabe, pore khota bolbe. not need now company off', NULL, 'Disqualified', '2021-03-14 21:18:27', '2022-06-05 01:58:04'),
(154, 'Dr Salahuddin Mahmud', NULL, '01819292138', NULL, NULL, NULL, NULL, 'Website, number off', NULL, 'Disqualified', '2021-03-14 21:20:30', '2022-06-18 04:29:39'),
(155, 'unknown', NULL, '01819161427', NULL, NULL, NULL, NULL, 'ecommerce', NULL, 'Disqualified', '2021-03-14 21:21:35', '2022-06-05 01:51:50'),
(156, 'unknown', NULL, '01905409976', NULL, NULL, NULL, NULL, 'website design number off', NULL, 'Disqualified', '2021-03-14 21:22:29', '2022-06-05 01:51:41'),
(157, 'unknown', NULL, '01816999946', NULL, NULL, NULL, NULL, 'website,  number off', NULL, 'Disqualified', '2021-03-14 21:23:06', '2022-06-05 01:51:32'),
(158, 'Mahjabeen Tabassum', 'Mahjabeen.Tabassum@gmail.com', '01632666600', NULL, NULL, NULL, NULL, 'she need 3D picture .need to give him proposal and some demo.', NULL, 'lead', '2021-03-14 21:46:27', '2022-06-19 02:37:10'),
(159, 'DR MD ZAKIR HOSSAIN', 'sheikhrusselsc@gmail.com', '01842585744', NULL, NULL, NULL, 'Road no-3, D I T Project, Merul Badda, Dhaka-1212, Bangladesh', 'the meeting was done by Imtiaj vai .positive \r\nwebsite design pac 3 .', NULL, 'Proposal Sent', '2021-03-15 17:00:35', '2021-03-15 19:56:18'),
(160, 'Subbrina Anwar', 'subbrina@gmail.com', '01707619707', NULL, NULL, 'ConsulMatrix', NULL, '20.06.2022-Call receive korsena', NULL, 'lead', '2021-03-15 17:55:45', '2022-06-20 05:31:23'),
(161, 'Jony Sir', NULL, '01881594697', NULL, NULL, NULL, NULL, 'https://www.binany24.com/ Romjaner pora koraba\r\nlike this website\r\n20.06.2022-nijer Fnd ke diye koriye niyese.', NULL, 'Contacted', '2021-03-15 19:22:13', '2022-06-20 05:29:40'),
(162, 'Mitu ( creative Education)', 'creative.ab21@gmail.com', '01315551358', NULL, NULL, 'creative Education', NULL, 'they are looking for that kind of website which will be similar to this.\r\nhttp://www.studynet.com.au/\r\nhttp://www.apollointl.com.au/', NULL, 'Converted to Customer', '2021-03-15 19:26:22', '2021-03-30 22:49:05'),
(163, 'shaikat', 'shaikatkhan033@gmail.com', '01321742061', NULL, NULL, NULL, NULL, 'Digital marketing\r\n20.06.2022-apatoto kono service lagsena . lagle obossoy janabe', NULL, 'Contacted', '2021-03-15 22:12:45', '2022-06-20 05:34:26'),
(164, 'Minhajul Hasan Bhuiyan', 'minhaj@knitasia.com', '01755596324', NULL, NULL, 'New Asia Group', '117/A Tejgaon , Dhaka .', 'Website redesign\r\nhttps://newasiabd.com/\r\nhttps://www.masholdings.com/\r\nhttp://aurum.com.bd/\r\n20.06.2022-Mobile off', NULL, 'Disqualified', '2021-03-15 22:15:52', '2022-06-20 05:48:41'),
(165, 'Abdur Rob', 'abdurrobsk@gmail.com', '01726750276', NULL, NULL, NULL, NULL, 'Ecommerce Website design proposal sent already please followup.\r\nTell me to call 20 March pore korbe', NULL, 'Disqualified', '2021-03-16 06:50:15', '2022-06-18 03:47:08'),
(166, 'Rasel', NULL, '01712458299', NULL, NULL, NULL, NULL, 'Looking for logo\r\n20.06.2022-Rong number', NULL, 'Disqualified', '2021-03-16 21:14:27', '2022-06-20 05:51:13'),
(167, 'Ruhul anim', NULL, '01647424701', NULL, NULL, NULL, NULL, 'Ecommerce websites. \r\nWill come tomorrow after 3 pm', NULL, 'Disqualified', '2021-03-16 23:55:12', '2022-06-14 02:31:09'),
(168, 'Nur Alamin', NULL, '01818714683', NULL, NULL, NULL, NULL, 'sstech kaj done kore  felse\r\n20.06.2022-ei muhurte website banate chaina.', NULL, 'Contacted', '2021-03-17 02:38:27', '2022-06-20 05:54:51'),
(169, 'Parvej', NULL, '01781586793', NULL, NULL, NULL, NULL, 'Redesign...Phone off\r\n20.06.2022-amader kas theke website niyese but ekhon ar business korsena', NULL, 'Contacted', '2021-03-17 04:45:57', '2022-06-20 05:58:03'),
(170, 'Sajib', NULL, '01314661875', NULL, NULL, NULL, NULL, 'website done', NULL, 'Disqualified', '2021-03-17 04:47:00', '2022-06-18 01:30:45'),
(171, 'Jahidur Rahman', 'mitho330@gmail.com', '01916063321', NULL, NULL, 'Royals BD', '147/3, Joar shahara, Vatara', 'Project  unsuccessful', NULL, 'Converted to Customer', '2021-03-17 04:48:46', '2021-07-08 07:56:34'),
(172, 'Sardar Hasan', 'engrhasan23975@gmail.com', '01933078858', NULL, NULL, 'Town Shop BD,', 'A/3, Flat: 5B, Sayabithi,', NULL, NULL, 'Disqualified', '2021-03-17 08:42:50', '2022-06-18 01:32:37'),
(173, 'MD Musleuddin', 'fastsellbuy.com@gmail.com', '01714758251', NULL, NULL, NULL, NULL, 'Ecoommerce website korabe.. tar basa banasree net din ashbe office e.. take address text korte bolse...Proposal and Quatetion send', NULL, 'Converted to Customer', '2021-03-17 23:05:33', '2021-03-27 19:56:15'),
(174, 'Robiul Islam', 'robiulislam84@gmail.com', '01778358137', NULL, NULL, NULL, NULL, 'hazi soriyat ullah model madrasa  email e requirement pathasie.. email check koren...[kalk office e giye kaj bujhe nite bolse] kaje\r\ndiea desa', NULL, 'Proposal Sent', '2021-03-17 23:09:30', '2021-05-28 22:39:26'),
(175, 'tonny', NULL, '01750048058', NULL, NULL, NULL, 'kustia', 'ecommerce website design not intersted', NULL, 'Disqualified', '2021-03-17 23:54:17', '2022-06-18 00:57:00'),
(176, 'unknown', NULL, '01724748906', NULL, NULL, NULL, NULL, 'signboar theke alibabar moto site korbe wordpress diye number off', NULL, 'Disqualified', '2021-03-17 23:54:54', '2022-06-05 01:51:21'),
(177, 'Unknown', NULL, '01841199535', NULL, NULL, NULL, NULL, 'freelancer e kaj niye amader ke dibe', NULL, 'Disqualified', '2021-03-17 23:55:31', '2022-06-05 01:49:58'),
(178, 'adv shazzad', 'adv.shazzad@yahoo.com', '01916002224', NULL, NULL, NULL, NULL, 'if need he will call me. number off', NULL, 'Disqualified', '2021-03-17 23:56:08', '2022-05-31 04:03:24'),
(179, 'sumon', NULL, '01688518662', NULL, NULL, NULL, NULL, 'grocery ecommerce pore korabe after eid', NULL, 'Disqualified', '2021-03-17 23:56:15', '2022-06-18 02:01:34'),
(180, 'asif', NULL, '01721831809', NULL, NULL, NULL, NULL, 'cotton - himu it 8k fixed', NULL, 'Disqualified', '2021-03-17 23:58:46', '2022-06-17 22:35:39'),
(181, 'sam mohiuddin', 'khan2014.business@gmail.com', '01674406142', NULL, NULL, 'Healthy Lifestyle Tips Tv', NULL, 'healthylifestyletipstv.com pore kotha bolbe', NULL, 'Converted to Customer', '2021-03-17 23:58:55', '2022-04-17 22:38:52'),
(182, 'palash gazi', NULL, '01710878887', NULL, NULL, NULL, NULL, 'call not received', NULL, 'Disqualified', '2021-03-18 00:02:41', '2022-06-18 04:27:52'),
(183, 'hasan', NULL, '01717994067', NULL, NULL, NULL, NULL, 'news portal 14k. not need if need he will call me.', NULL, 'Disqualified', '2021-03-18 00:02:54', '2022-06-18 02:36:27'),
(184, 'bdems raju', NULL, '01739456878', NULL, NULL, NULL, NULL, 'bdems raju number off', NULL, 'Disqualified', '2021-03-18 00:03:39', '2022-06-16 03:24:07'),
(185, 'Unknown', NULL, '01816043555', NULL, NULL, NULL, NULL, 'news portal korabe. nagarkantha refference e ashce.. busy', NULL, 'Disqualified', '2021-03-18 00:04:26', '2022-06-05 01:46:39'),
(186, 'unknown', NULL, '01677307674', NULL, NULL, NULL, NULL, 'website design number off', NULL, 'Disqualified', '2021-03-18 00:05:32', '2022-06-05 01:46:30'),
(187, 'Unknown', NULL, '01629002222', NULL, NULL, NULL, NULL, 'e-commerce website banabe call din busy pore kotha bolbe', NULL, 'Disqualified', '2021-03-18 00:06:06', '2022-06-05 01:46:19'),
(188, 'Unknown', NULL, '01720448666', NULL, NULL, NULL, NULL, 'ambulance service dey.. Ei related website banabe done by others', NULL, 'Disqualified', '2021-03-18 00:06:36', '2022-06-05 01:46:10'),
(189, 'unknown', NULL, '01819273424', NULL, NULL, NULL, NULL, 'business website design  khalil imperial done call not received', NULL, 'Disqualified', '2021-03-18 00:06:40', '2022-06-05 01:42:22'),
(190, 'Shahed Azaz Ahmed Razon', NULL, '01788309029', NULL, NULL, NULL, NULL, 'call for gsuite (premiem email service). not need. if need he will call me.', NULL, 'Contacted', '2021-03-18 00:07:39', '2022-06-18 01:51:24'),
(191, 'sahil', 'ricengineerings@gmail.com', '01723769633', NULL, NULL, NULL, NULL, 'ecommerce korabe grocery jonno..  ----- proposal send korsi.. followup korte thaken.. ----- booss desher ace boss tai ekhn o kuno result nai... projone call dibe', NULL, 'Disqualified', '2021-03-18 00:08:08', '2022-06-16 03:23:32'),
(192, 'unknown', NULL, '01688123817', NULL, '01620009143', NULL, NULL, 'http://www.jafdasunity.com/ garment site redesign indian sala', NULL, 'Disqualified', '2021-03-18 00:09:05', '2022-06-05 01:42:10'),
(193, 'monir vaimonir vai', 'moonpowerengineering@gmail.com', '01761810036', NULL, NULL, NULL, NULL, 'moon power engineering grocery website  mirpur 10 e office .. proposal send korsi.. followup korte thaken....number off', NULL, 'Disqualified', '2021-03-18 00:09:36', '2022-06-15 04:43:50'),
(194, 'Unknown', NULL, '01844543351', NULL, NULL, NULL, NULL, 'Dhaka colo website redesign or new design  https://www.dhakacolo.com/contact-us/done by others', NULL, 'Disqualified', '2021-03-18 00:11:47', '2022-06-05 01:40:18'),
(195, 'swapan bhattacharjee', NULL, '01746733979', NULL, NULL, NULL, NULL, 'shopno er moto uper store er software. not need now. if need he will call me', NULL, 'Disqualified', '2021-03-18 00:11:51', '2022-06-18 04:29:33'),
(196, 'rasel sikder', 'srasel87@yahoo.com', '01674481722', NULL, NULL, NULL, NULL, 'number off', NULL, 'Disqualified', '2021-03-18 00:12:47', '2022-06-18 04:48:28'),
(197, 'enamul karim', NULL, '01842553391', NULL, NULL, NULL, NULL, 'murgi sell korbe online e. if need he will call me.', NULL, 'Disqualified', '2021-03-18 00:12:57', '2022-06-16 03:34:48'),
(198, 'ashraf uddin', NULL, 'chaldal er moto website lagbe..', NULL, NULL, NULL, NULL, 'chaldal er moto website lagbe..', NULL, 'Contacted', '2021-03-18 00:14:03', '2022-06-05 05:39:40'),
(199, 'md nuruzzaman', 'brand-dhk@qandqbd.com', '01955508036', NULL, NULL, NULL, NULL, '. brand executive, Q and Q Trading Ltd   high budget laravel site lagbe proposal sent altready..korabe na', NULL, 'Contacted', '2021-03-18 00:14:56', '2022-06-05 05:40:07'),
(200, 'Unknown', NULL, '01822219444', NULL, NULL, NULL, NULL, 'chinacampus.com.bd redesign and also admitkard.com new website like this eid er por kotha bolbe', NULL, 'Disqualified', '2021-03-18 00:16:16', '2022-06-05 01:40:07'),
(201, 'Kazi Iftakhar Alam', 'iftakhar042@gmail.com', '01672808182', NULL, NULL, NULL, NULL, 'garment webiste .. mailed with sample website ..number off', NULL, 'Disqualified', '2021-03-18 00:31:24', '2022-06-16 03:28:46'),
(202, 'shahadathossainshakil', 'shahadathossainshakil12@gmail.com', '01998335108', NULL, NULL, NULL, NULL, 'ecommerce website korabe.. ---------- gulshan 2 e home and appliance er dokan ace ekhn website korabe..  transcom er moto... 20k budget ---busy--------- 14/08 phn disilo..\r\ncall received kore na', NULL, 'Disqualified', '2021-03-18 00:33:34', '2022-06-16 02:30:47'),
(203, 'unknown', NULL, '01729438102', NULL, NULL, NULL, NULL, 'horchow.com er moto ecommerce banabe.. wordpress 25k megento 120k laravel 150k asp.net 200k bole disi. if need he will call me done by others', NULL, 'Contacted', '2021-03-18 00:34:03', '2022-06-05 05:40:34'),
(204, 'azizur rahman', 'azizurrahmanjohn@yahoo.com', '01719079971', NULL, NULL, NULL, NULL, 'not need.', NULL, 'Disqualified', '2021-03-18 00:35:08', '2022-06-16 02:41:58'),
(205, 'Morshed', 'murshidanower2020@gmail.com', '01747200488', NULL, NULL, NULL, NULL, 'Looking for Software/ Web Apps Development', NULL, 'Disqualified', '2021-03-18 00:35:56', '2022-06-16 02:30:22'),
(206, 'unknown', NULL, '01575496694', NULL, NULL, NULL, NULL, 'himu it missed call\r\n18.06.2022- Invalid number', NULL, 'Disqualified', '2021-03-18 00:36:13', '2022-06-18 01:00:32'),
(207, 'jakieul', 'jakieul@gmail.com', '01914123600', NULL, NULL, NULL, NULL, 'digifish ecommerce website design korabe.. proposal sent kora hoise...', NULL, 'Disqualified', '2021-03-18 00:36:52', '2022-06-16 02:32:34'),
(208, 'Unknown', NULL, '01848307358', NULL, NULL, NULL, NULL, 'https://en.sangchaigroup.com/  ecommerce website and mobile apps korabe..-----------------------', NULL, 'Contacted', '2021-03-18 00:38:13', '2022-06-05 05:41:17'),
(209, 'sorab saikat', NULL, '01833441114', NULL, NULL, NULL, NULL, 'graphics design monthly package niye chay... fb te page er link and email pathabe proposal sent korte hobe..done by others...', NULL, 'Disqualified', '2021-03-18 00:41:43', '2022-06-16 02:38:11'),
(211, 'mehedi hasan', 'mehedihasan1511994@gmail.com', '01550051050', NULL, NULL, NULL, NULL, '- mogbazar -- ecommerce korte cay. demo sent korte hobe. off\r\n26/06/20 number off\r\n18.06.2022-Mobile sob somoy bondo thake', NULL, 'Disqualified', '2021-03-18 00:44:50', '2022-06-18 00:58:59'),
(212, 'Imam Vai', NULL, '01720339293', NULL, NULL, NULL, NULL, 'PBL 15k website design korate chay ecommerce.-------------------- satuday ashbe.', NULL, 'Disqualified', '2021-03-18 00:46:00', '2022-06-18 04:48:45'),
(213, 'mrs rokeya bari', 'rokeya.bari@yahoo.com', '01711864056', NULL, '01971864056', NULL, NULL, 'mrs rokeya bari gulshan avenue theke ecommerce multivendor website korbe, proposal sent. if need he will call me', NULL, 'Disqualified', '2021-03-18 00:46:50', '2022-06-16 01:57:57'),
(214, 'zahid mahamud', NULL, '01730052155', NULL, '01730096613', NULL, NULL, 'ecommecre website design korte chay.. whats appe e already sample website link pathaisi... dekhe janabe...--------------------------- if need he will call me.no response', NULL, 'Disqualified', '2021-03-18 00:53:37', '2022-06-16 02:44:47'),
(215, 'khaladur', 'psf.khaladur@gmail.com', '01643394772', NULL, NULL, NULL, NULL, 'website redesign korabe.. non profit oraization er jonno.. psf.micro@gmail.com ---- website done by others\r\n18.06.2022-jekhan theke website baniyese sey khan theke onnanno service nisse', NULL, 'Contacted', '2021-03-18 00:53:45', '2022-06-18 00:57:52'),
(216, 'Unknown', NULL, '01810276803', NULL, NULL, NULL, NULL, 'mgt-vegetablefruitsbd.com  website redesign korabe... office jaite bole palton.done by others\r\n18.06.2022-Onk bar call dewa holo but call receive korena', NULL, 'Disqualified', '2021-03-18 00:54:20', '2022-06-18 01:14:54'),
(217, 'Sabrina Imam', 'thunderilla@gmail.com', '01793592659', NULL, NULL, NULL, NULL, 'ecommerce erbsite banabe.. proposal pathano hoise...   porshu din 5 tay meeting ----------- no response', NULL, 'Disqualified', '2021-03-18 00:55:16', '2022-06-06 05:49:53'),
(218, 'unknown', NULL, '01712111884', NULL, NULL, NULL, NULL, 'shuvo automobile accessories and spare parts ecommerce korabe.. whatsapp e demo sob ecommerce pathaisi... meeting korte chay.. already meeting kore gese and detail niye gese....--------\r\nif need he will call me--- pore  korabe', NULL, 'Disqualified', '2021-03-18 00:55:20', '2022-06-05 01:39:47'),
(219, 'Imona Hossain', 'imonahossain@hotmail.com', '01707006401', NULL, NULL, NULL, NULL, 'ecommerce website and fb adverting proposal sent already.number off', NULL, 'Disqualified', '2021-03-18 00:56:20', '2022-06-18 04:48:39');
INSERT INTO `clients` (`id`, `name`, `email`, `phone`, `secondary_email`, `secondary_phone`, `company`, `address`, `note`, `photo`, `status`, `created_at`, `updated_at`) VALUES
(220, 'unknown', NULL, '01818315074', NULL, '01812258925', NULL, NULL, 'ali.com.bd mobile apps banabe whats app e demo link pathaisi... if need he will call me ....plan nai akhon', NULL, 'Disqualified', '2021-03-18 00:56:35', '2022-06-16 02:52:15'),
(221, 'rana', 'rana@sterlinginternationalgroup.com', '01626400165', NULL, NULL, NULL, NULL, 'ecommerce website korebe woocommerce diye.. payment gateway tar sathe kotha hose.. oni MD sir er sathe kotha bole janbe..... pore korbe\r\n18.06.2022-Ecommerce er website banabe kisudin por but Proposal cheyese.tai Proposal pathano hoilo', NULL, 'Proposal Sent', '2021-03-18 00:57:06', '2022-06-18 00:40:55'),
(222, 'km masud', 'kmmasud09@gmail.com', '01976025944', NULL, NULL, NULL, NULL, 'personal website banabe  (web for solution theke kore felse).\r\n16.06.2022-6000tk diye website baniyese ekhon cholena', NULL, 'Contacted', '2021-03-18 00:57:40', '2022-06-16 06:00:24'),
(223, 'mr ninmoy', NULL, '01936009009', NULL, NULL, NULL, NULL, 'bengal group er website redesign korbe amadeer ke info@ te requirement send korse .. amader ke dekhe then feedback dite hobe...korle janabe', NULL, 'Disqualified', '2021-03-18 00:57:48', '2022-06-16 01:28:55'),
(224, 'Unknown', 'origingadgetbd@gmail.com', '01707400005', NULL, NULL, NULL, NULL, 'ecommerce website korabe.. agge logo koraise amader kach theke... pore korabe\r\n16.06.2022-Number Off', NULL, 'Disqualified', '2021-03-18 00:58:40', '2022-06-16 05:51:39'),
(225, 'unknown', 'shommy75@gmail.com', '01977004549', NULL, NULL, NULL, NULL, 'ekta games er website design korbe theme kine dibe customize korte hobe sathe ekta frocery korbe theme kine dibe customize korte hobe..pore call korbe', NULL, 'Disqualified', '2021-03-18 00:59:05', '2022-06-05 01:39:26'),
(226, 'Tareq Masud', 'tmasud9@gmail.com', '01706401667', NULL, NULL, NULL, NULL, 'ecommerce website design package sent', NULL, 'Contacted', '2021-03-18 00:59:33', '2022-06-16 00:34:28'),
(227, 'masum', NULL, '01819213842', NULL, NULL, NULL, NULL, 'pharmecy bazar er moto website korbe. ecommerce. onake name phn degignation sms korte hobe. website done', NULL, 'Disqualified', '2021-03-18 00:59:51', '2022-06-16 00:34:36'),
(228, 'Abdul kaiyum', 'sunrisei_7@yahoo.com', '01820427429', NULL, NULL, NULL, NULL, 'sunrise international 80, jibon bima bhaban , 4 th floor dhaka 1000, motikheel office trading company and menufacture company informative website korbe.. office jete bole.after eid korabe interested', NULL, 'Disqualified', '2021-03-18 01:00:36', '2022-05-31 04:01:35'),
(229, 'Unknown', NULL, '01911348404', NULL, NULL, NULL, NULL, 'news portal korte chay... theme kine dibe.. amader setup kore dite hobe.. 10k fixed bole disi....invalid number\r\n16.06.2022-Number off', NULL, 'Disqualified', '2021-03-18 01:03:08', '2022-06-16 05:50:00'),
(230, 'mizan vai', 'updateautomation@gmail.com', '01717438605', NULL, NULL, NULL, NULL, 'update automation ecommerce proposal sent.sat day office ashbe.. 22/03/2021 -- Pore contact korbe.. number off', NULL, 'Disqualified', '2021-03-18 01:04:18', '2022-06-16 01:57:16'),
(231, 'abdul kaiyum', NULL, '01626149202', NULL, NULL, NULL, NULL, 'abdul kaiyum grocery ecommerce website korabe proposal and demo sent korsi whatsapp e...number off\r\n16.06.2022-Off Number', NULL, 'Disqualified', '2021-03-18 01:06:21', '2022-06-16 05:43:19'),
(232, 'Shafiqul Alam Chowdhury Hemel', NULL, '01766669936', NULL, NULL, NULL, NULL, 'amazecorp.com crm@amazecorp.com logo restoration work.. quote 2k. ora e janabe pore..number invalid\r\n16.06.2022-Number off thake sob somoy', NULL, 'Disqualified', '2021-03-18 01:07:36', '2022-06-15 22:06:47'),
(233, 'unknown', NULL, '01923406267', NULL, NULL, NULL, NULL, '30/06/2020\r\napps development korbe wordpress site er jonno.. ecommerce... amader email send kora hoise.. oni details pathabe... Not interested', NULL, 'Contacted', '2021-03-18 01:09:11', '2022-06-16 05:41:05'),
(234, 'adi', NULL, '01677057556', NULL, NULL, NULL, NULL, 'smplbd.com redesign korabe.... job chere dise\r\n16.06.2022-pore kotha bolbe', NULL, 'Disqualified', '2021-03-18 01:10:09', '2022-06-16 05:40:24'),
(235, 'Unknown', 'it@zadidlabel.com', '01973386880', NULL, NULL, NULL, NULL, 'website design proposal sent it@zadidlabel.com lavel printing company. Call him after 15 days pore call dibe', NULL, 'Disqualified', '2021-03-18 01:11:00', '2022-06-05 01:37:50'),
(236, 'unknown', NULL, '01713884423', NULL, NULL, NULL, NULL, 'dont distrub. mc\r\n16.06.2022-Call dewa jabena', NULL, 'Disqualified', '2021-03-18 01:11:15', '2022-06-16 05:39:04'),
(237, 'Unknown', NULL, '01821106363', NULL, NULL, NULL, NULL, 'call korse chaldal er moto ekta website lagbe.. almost confirm 30k te confirm kormu.. ---------------- website done by others', NULL, 'Disqualified', '2021-03-18 01:11:43', '2022-06-05 01:39:05'),
(238, 'Unknown', NULL, '01986247644', NULL, NULL, NULL, NULL, 'newsportal transfer kore amader kache niye ashbe...pore call dibo', NULL, 'Disqualified', '2021-03-18 01:12:33', '2022-06-05 01:37:35'),
(239, 'azharul islam joy', 'mazharuljoy71@gmail.com', '01305844743', NULL, NULL, NULL, NULL, 'ecommerce website design proposal sent. ekhn korbe na pore janabe... number invalid\r\n16.06.2022-NumberOff', NULL, 'Disqualified', '2021-03-18 01:13:09', '2022-06-16 05:38:22'),
(240, 'unknown', NULL, '01315327810', NULL, NULL, NULL, NULL, 'himu it 4 times phn...\r\n04/07/2020 number off', NULL, 'Disqualified', '2021-03-18 01:15:01', '2022-06-05 01:37:24'),
(241, 'Mahim', NULL, '01811125775', NULL, NULL, NULL, NULL, 'website design. call korbe number off', NULL, 'Disqualified', '2021-03-18 01:15:05', '2022-06-04 23:09:13'),
(242, 'Touhid', NULL, '01987009816', NULL, NULL, NULL, NULL, 'website design', NULL, 'Disqualified', '2021-03-18 01:15:29', '2022-06-05 03:51:29'),
(243, 'kammrul islam', NULL, '01762009955', NULL, NULL, NULL, NULL, 'website design janabe', NULL, 'Disqualified', '2021-03-18 01:15:51', '2022-06-06 05:49:39'),
(244, 'mr. ashis', 'ashisdip@gmail.com', '01711126306', NULL, NULL, NULL, NULL, 'covid 19 8k package nibe... phn dea lagbe na oni pore communicate korbe... if nedd he will call me.\r\n15.06.2022-ekhon website korbena .jokhon korbe nije theke amaderke knock korben', NULL, 'Contacted', '2021-03-18 01:16:52', '2022-06-15 05:31:55'),
(245, 'nobin', 'nobin@perfumeworldltd.com', '01711147060', NULL, NULL, NULL, NULL, 'manager perfume world 81/ka. 7th floor, road-11, baridhara diplomatic zone  nobin@perfumeworldltd.com  ecommecre website design proposal sent\r\n16.06.2022-call kete dey', NULL, 'Contacted', '2021-03-18 01:17:05', '2022-06-16 05:37:33'),
(246, 'shipon', NULL, '01708884689', NULL, NULL, NULL, NULL, 'website korbe.. management er sathe kotha bole janabe 50k wordpress laravel 8lac. 05/07/2020.  22//03/2021 ---- if need he will call me. website done\r\n15.06.2022 kisu din agey onno ekta company theke niyese but onno kaj dorkar hoile janane', NULL, 'Contacted', '2021-03-18 01:17:59', '2022-06-15 02:28:52'),
(247, 'Unknown', 'nationalprinting99@gmail.com', '01841086719', NULL, NULL, NULL, NULL, 'website desihn and ecommerce proposal both sent...no resp\r\n15.06.2022 onno protisthan theke niye use korse but ekhon kisu lagle janabe', NULL, 'Contacted', '2021-03-18 01:18:05', '2022-06-16 05:36:07'),
(248, 'unknown', NULL, '01784211721', NULL, NULL, NULL, NULL, 'goldenrose.com.tr  mail korbe requirement.. ekhn o pai nai mail....', NULL, 'lead', '2021-03-18 01:18:47', '2021-11-30 03:25:09'),
(249, 'imdnurul', 'imdnurul457@gmail.com', '01724717727', NULL, NULL, NULL, NULL, 'ecommerce website proposal sent.. 4 tarikh phn dite hobe.----------- kal asbe and confirm korbe---number off\r\n15.06.2022 Mobile off', NULL, 'Disqualified', '2021-03-18 01:19:03', '2022-06-15 03:10:25'),
(250, 'unknown', NULL, '01711882931', NULL, NULL, NULL, NULL, 'domain hosting renew korte hobe namecheap theke arbnenew korte na parle then new website create korbe..not interested\r\n16.06.2022-kono kisu lagbena thanks', NULL, 'Disqualified', '2021-03-18 01:19:12', '2022-06-16 05:35:36'),
(251, 'unknown', NULL, '01721294635', NULL, NULL, NULL, NULL, 'law firm businees page and website design amader email send korsi oni requirement pathabe...invalid number\r\n16.06.2022-Number use hossena', NULL, 'Disqualified', '2021-03-18 01:19:58', '2022-06-16 05:34:55'),
(252, 'obaidul rahman', 'Admin@globalstar.com.bd', '01911342308', NULL, NULL, NULL, NULL, 'global star ltd  website banabe 4 ta group of company type emai kora hoise proposaL Admin@globalstar.com.bd\r\n custom quotation', NULL, 'Disqualified', '2021-03-18 01:20:28', '2022-06-16 00:50:15'),
(253, 'unknown', NULL, '01722060543', NULL, NULL, NULL, NULL, 'HIMU IT  al amin dokhin badda theke indistrila item ecommerce website design. if need he wil call me', NULL, 'Disqualified', '2021-03-18 01:20:42', '2022-06-05 01:29:20'),
(254, 'kochivai', 'kochivai@gmail.com', '01400125127', NULL, NULL, NULL, NULL, 'ecommerce website design korbe.....number off\r\n16.06.2022-bondur jonno ecommerce  er website banate cheyesilo but seta ekhon ar banabena', NULL, 'Disqualified', '2021-03-18 01:21:18', '2022-06-16 05:33:21'),
(255, 'unknown', NULL, '01991564939', NULL, NULL, NULL, NULL, 'ecommerce website next din followup. Phone not recive akhon lagbe na', NULL, 'Disqualified', '2021-03-18 01:22:01', '2022-06-05 01:29:10'),
(256, 'shah newaz', 's.m.shahnawaz.bd@gmail.com', '01711295618', NULL, NULL, NULL, NULL, 'ecommerce proposal sent oni laravel er kaj korate chay...no response', NULL, 'Disqualified', '2021-03-18 01:22:51', '2022-06-16 01:29:19'),
(257, 'Unknown', NULL, '01731679745', NULL, NULL, NULL, NULL, 'domain hosting beattiresbd. afferices  domain name chec and website design', NULL, 'Disqualified', '2021-03-18 01:22:57', '2022-06-05 01:26:42'),
(258, 'Sharmin Nahar', 'sharmin.nahar@miaki.co', '01939900086', NULL, NULL, NULL, NULL, 'ecommerce website proposal sent. job chere disee onk bar call  kora hoise ..call na deyar jonno request korse\r\n16.06.2022- madam je office a silo ,sey office a ar nai .tai ar jeno call kora na hoi', NULL, 'Disqualified', '2021-03-18 01:23:46', '2022-06-16 05:29:33'),
(259, 'Unknown', NULL, '01785854701', NULL, NULL, NULL, NULL, 'bengol.net and bengolnet.com  website special requirement . kyc form online submission and others forms download iption. 2. online submission and rgistration. 3. news links. 4. location form for offices 5. coverage area 6. major client list. 7. other isp website common options\r\n16.06.2022-Call Receive korsena', NULL, 'Contacted', '2021-03-18 01:24:03', '2022-06-16 04:41:27'),
(260, 'saif', 'bestsaif36@gmail.com', '01723512962', NULL, NULL, NULL, NULL, 'grocery ecommerce website korabe niketan basa 12k er ta nite pare..--------------number off\r\n16.06.2022-Bar bar call kete dey', NULL, 'Contacted', '2021-03-18 01:24:38', '2022-06-16 04:36:57'),
(261, 'amir', NULL, '01401443101', NULL, NULL, NULL, NULL, 'ecommerce website korabe... phone not recived', NULL, 'Disqualified', '2021-03-18 01:24:48', '2022-06-05 04:47:02'),
(262, 'Mohammed Asaduzzaman', 'asad.zaman@entekso.com', '01713039630', NULL, NULL, NULL, NULL, 'Mohammed Asaduzzaman CEO Entekso Edu ecommerce website proposal sent already.... course enroll korbe and payment korbe...... asad.zaman@entekso.com, hasan.amin@entekso.com, ahsan.kabir@entekso.com----------hasan banasree-----------------------------------no response', NULL, 'Disqualified', '2021-03-18 01:26:01', '2022-06-18 04:29:46'),
(263, 'ibne hasan', 'ibne_hasan@yahoo.com', '01970058258', NULL, NULL, NULL, NULL, 'ecommerce korabw 12 k package... website e contact korse. proposal sent janabe ...  ekhn o kotha cholese .. hole janabe. If need he will call me no response\r\n16.06.2022-Jomir dalil likhon er jonno Facebook Marketing korabe Proposal Pathano hoyese', NULL, 'Proposal Sent', '2021-03-18 01:26:06', '2022-06-16 04:38:25'),
(264, 'Rahat Sami', 'rahatsami27@gmail.com', '01863915901', NULL, NULL, NULL, NULL, 'restaurent er website korbe... proposal sent ...., work by others done', NULL, 'Disqualified', '2021-03-18 01:26:36', '2022-06-05 03:51:09'),
(265, 'sajib gaibhandha', 'sojeebsarker72@gmail.com', '01868346683', NULL, NULL, NULL, NULL, '1.25 sajib gaibhandha clipping path er website korte chay.... office ese meeting kore gese... eid er por knock .. number off\r\n16.06.2022-Car Business er jonno ecommerce er website banabe kisudin por but kisu link soho proposal pathate bolesen.pathalam', NULL, 'Proposal Sent', '2021-03-18 01:27:12', '2022-06-16 01:18:13'),
(266, 'yeasir', 'bachchuenterprise@yahoo.com', '01726959607', NULL, NULL, NULL, NULL, 'yeasir bac website pos erp nibe.. md sir er sathe kotha bole final korbe... bachchuenterprise@yahoo.com proposal sent...\r\n16.06.2022-meeting ase ektu por phone dite hobe', NULL, 'Contacted', '2021-03-18 01:28:17', '2022-06-15 22:28:02'),
(267, 'rased', NULL, '01404047804', NULL, NULL, NULL, NULL, 'green delta investment   website dedesign korabe.. info@ e requirement pathabe.. account creation and and online payment thakbe...  ekta design mok kore pathate hobe... then kaj dibe....\r\n\r\n13/07/2020 korabe pore', NULL, 'Disqualified', '2021-03-18 01:29:42', '2022-06-05 03:50:55'),
(268, 'borshaahmed', 'borshaahmedb@gmail.com', '01778890859', NULL, NULL, NULL, NULL, 'Borsha Ahmed Ecommerce multi Vendor Website Korabe... proposal sent ....   borshaahmedb@gmail.com. phone not recived. website done', NULL, 'Disqualified', '2021-03-18 01:29:45', '2022-06-16 03:02:45'),
(269, 'salim khan', 'selimvhai@gmail.com', '01710752800', NULL, NULL, NULL, NULL, 'salim khan website create korbe... rat 9 tay khota bolbe. next month call him\r\n15.06.2022-next din kotha bolbe.\r\n16.06.2022-Proposal pathalam', NULL, 'Proposal Sent', '2021-03-18 01:30:22', '2022-06-16 00:49:47'),
(270, 'md monowar hossain', 'monowar1968@gmail.com', '01313795640', NULL, NULL, NULL, NULL, 'general manager, tobex group, 4 mohakhali level 3, pubali bank building, jeye kotha bolte hobe... monowar1968@gmail.com 01757331492 tobex group md number off\r\n16.06.2022-Number Off thake sob somoy', NULL, 'Disqualified', '2021-03-18 01:31:02', '2022-06-15 22:24:39'),
(271, 'Ujjal Suvecha', NULL, '01313500365', NULL, NULL, NULL, NULL, 'Gift  multivendor ecommerce and pos erp nibe...m------ oni mail address pathabe... ---- phone not recived, akhon korar chinta nai', NULL, 'Disqualified', '2021-03-18 01:31:10', '2022-06-15 04:32:18'),
(272, 'prinka tasnuva', NULL, '01716883214', NULL, NULL, NULL, NULL, 'ecommerce website korbe COVID 19 package 15k te...-------------------------------, pore khota bolbe', NULL, 'Disqualified', '2021-03-18 01:32:27', '2022-06-05 04:46:52'),
(273, 'Mitu properties', 'mituproperties.ltd@gmail.com', '01761319181', NULL, NULL, NULL, NULL, 'informative website email pathaise.. proposL SEND KORBO.... mituproperties.ltd@gmail.com md sir er sathe kotha bole janabe.. done by others\r\n16.06.2022-Call kete dissi bar bar', NULL, 'Contacted', '2021-03-18 01:32:31', '2022-06-15 22:23:07'),
(274, 'ripon', 'ripon102@gmail.com', '01923661003', NULL, NULL, NULL, NULL, 'workshop er jonno website korabe cummilla te email e proposal pathano hoise... dont distrub\r\n15.06.2022- jokhon korbe tokhon knock korbe', NULL, 'Contacted', '2021-03-18 01:33:25', '2022-06-15 05:33:50'),
(275, 'pallibiplob', 'pallibiplob1@gmail.com', '01930446747', NULL, NULL, NULL, NULL, 'Metro Furniture  er website redesign korabe... starkul tader factory.. sekhane jete hobe... online e custom furniture make kore tara....  proposal sent korsi already mail ee.....  pallibiplob1@gmail.com   Holdings: 391, Shadhinata Sarani North Badda, Dhaka  1212    Holdings : 17842, Road : 03, Taltola,Satarkul, North, Dhaka 1212   satarkul brize par hoye samne haater daane...-------------------------------------   kal 11 tay meeting.... number off', NULL, 'Disqualified', '2021-03-18 01:33:31', '2022-06-04 23:02:16'),
(276, 'Shafi Abdullah', 'rasultradingcorporation@gmail.com', '01307436136', NULL, '01644415444', NULL, NULL, 'proposal pathate hobe.15/07/2020 no response', NULL, 'Disqualified', '2021-03-18 01:34:37', '2022-06-04 23:02:35'),
(277, 'MOHAMMADFAHAD', 'MOHAMMADFAHAD1912@gmail.com', '01999666555', NULL, NULL, NULL, NULL, 'mohammed forhad hossain ovi   MOHAMMADFAHAD1912@gmail.com     business website design proposal and demo sent already...number off', NULL, 'Contacted', '2021-03-18 01:34:56', '2022-06-05 05:41:57'),
(278, 'ridwanul haque', 'ridwanulhaque62@gmail.com', '01870662146', NULL, NULL, NULL, NULL, 'online ebook sell korbe,.. ecommerce proposal sent...pore janabe', NULL, 'Disqualified', '2021-03-18 01:35:26', '2022-06-16 00:34:19'),
(279, 'unknown', 'arik.enterprise@yahoo.com', '01700933076', NULL, NULL, NULL, NULL, 'ecommer website korbe.. grocery.. proposal sent...  after eid call korte hobe..', NULL, 'Disqualified', '2021-03-18 01:36:02', '2022-06-05 01:23:05'),
(280, 'Unknown', 'dreameduapply@gmail.com', '01708520706', NULL, NULL, NULL, NULL, 'dream edu apply ....   dreameduapply@gmail.com     website design nad digital advertisement propoal sent... ---29/05/2021 proposal sent number off', NULL, 'Disqualified', '2021-03-18 01:36:10', '2022-06-04 22:51:06'),
(281, 'anwar hossain milon khan', 'shohag360degree@gmail.com', '01626562555', NULL, NULL, NULL, NULL, 'shohag360degree@gmail.com   ecommerce website design proposal sent.. ---------------------------- tamim', NULL, 'lead', '2021-03-18 01:36:52', '2022-06-19 02:37:10'),
(282, 'Abul Bashar', 'jbl.bashar@gmail.com', '01728850972', NULL, NULL, 'Sky fashion bd', 'paltan China town', 'ecommerce website korabe... proposal sent already..running work', NULL, 'Converted to Customer', '2021-03-18 01:37:08', '2021-05-03 01:05:32'),
(283, 'Mehedi hasan', 'Tusher1199@gmail.com', '01643865109', NULL, NULL, NULL, NULL, 'n   Tusher1199@gmail.com  android app for grocery item sell. You can send me best quote.', NULL, 'lead', '2021-03-18 01:37:36', '2022-06-19 02:37:10'),
(284, 'unknown', 'mktg4@bengalcement.com.bd', '01704161882', NULL, NULL, NULL, NULL, 'imu it contact korse bengal cement er website maintenace korabe... proposal pathate bolse... already sent kal phn dibo ...lagbe na\r\n16.06.2022-Mobile off', NULL, 'Contacted', '2021-03-18 01:37:42', '2022-06-15 22:21:43'),
(285, 'unknown', NULL, '01778640405', NULL, NULL, NULL, NULL, 'bikroy.com ar moto website krte cay. wordpress na. multibandor - laravel and asp.net ar package 6 and 7 ar prising bole disi. office address send send korte hobe. if need he will call me. pore janabe', NULL, 'Disqualified', '2021-03-18 01:38:34', '2022-06-05 01:22:22'),
(286, 'zaif rahman', 'zayfbbs@gmail.com', '01627352598', NULL, NULL, NULL, NULL, 'zayfbbs@gmail.com    radio today ecommerce korbe proposal pathate bolse.. sathe demo....------------------\r\n16.06.2022-derbosor age baniyese website onno kono service oo lagbena eimuhurte', NULL, 'Contacted', '2021-03-18 01:38:43', '2022-06-15 22:19:15'),
(287, 'unknown', 'mahfuzulhaque1960@gmail.com', '01716110610', NULL, NULL, NULL, NULL, 'graphic design korte cay. sticker print - package pathate hobe -', NULL, 'Disqualified', '2021-03-18 01:39:17', '2022-06-04 22:50:38'),
(288, 'rakibul hassan rassel', 'finelook2021@gmail.com', '01912465110', NULL, NULL, NULL, NULL, 'rakibul hassan rassel  finelook2021@gmail.com   rakhibul.rassal@gmail.com ecommerce website design korabe proposal pathano hoise...[need call him tomorrow]', NULL, 'lead', '2021-03-18 01:39:40', '2022-06-19 02:37:10'),
(289, 'jubaer', 'ark.jubaer@gmail.com', '01711156387', NULL, NULL, NULL, NULL, 'sample website http://www.rotarydistrict3282.org/  design proposal and monthly maitence pathano hoise... done by other\r\n15.06.2022-digital marketing er proposal pathate hobe', NULL, 'Proposal Sent', '2021-03-18 01:40:13', '2022-06-15 05:53:46'),
(290, 'imam hossain', 'asimitsbd@gmail.com', '01755949191', NULL, NULL, NULL, NULL, 'seo lagbe...after 3 month(producct add)he will call us', NULL, 'Proposal Sent', '2021-03-18 01:40:46', '2021-03-28 01:33:42'),
(291, 'madhusudhan bhoumik', NULL, '01731840166', NULL, NULL, NULL, NULL, 'madhusudhan bhoumik    monday phn zoom meetingg orbe seo korabe proposal pathano hoise...', NULL, 'lead', '2021-03-18 01:41:25', '2022-06-19 02:37:10'),
(292, 'Motaleb', NULL, '01839696919', NULL, NULL, NULL, NULL, 'Authority wave --  - package 1 bola hoise 20% discount soho - authority r sathe kotha bole janaben\r\n15.06.2022-jeni call dorese uni MD sir er sathe kotha bole janaben', NULL, 'Contacted', '2021-03-18 01:41:59', '2022-06-15 06:10:16'),
(293, 'md hasanul haq', NULL, '01734276281', NULL, NULL, NULL, NULL, 'it officer labonno screen print sl dhaka.com garment website banabe.. meeting kore ashce....------', NULL, 'lead', '2021-03-18 01:42:29', '2022-06-19 02:37:10'),
(294, 'amir hussain', 'amirhussain2619@gmail.com', '01920648894', NULL, NULL, NULL, NULL, 'ecommerce covid 19 package   send with demo 16 tarikh phn dibo asbe   - 22/03/2021-- Office a asbe.', NULL, 'Disqualified', '2021-03-18 01:42:29', '2022-06-05 03:50:27'),
(295, 'reaz', 'nimoco.bd@gmail.com', '01552351199', NULL, NULL, NULL, NULL, 'ecommerce website proposal sent already. if need he will call me ..korbe na website\r\n15.06.2022-ei muhurte dorkar nai tobe kisudin por amk knock kore office visit korbe', NULL, 'Contacted', '2021-03-18 01:43:05', '2022-06-15 05:37:20'),
(296, 'Nasir Uddin', 'nasiruddinuro@gmail.com', '01718332367', NULL, NULL, 'National Institute of kidney disease and urilogy.', 'Sher e Bangla Nagar .Dhaka', 'nasiruddinuro.com', NULL, 'Converted to Customer', '2021-03-18 01:43:07', '2021-07-07 07:34:23'),
(297, 'Rownu mam', 'tweetup.rounak@gmail.com', '01885999509', NULL, NULL, NULL, NULL, 'need to knock him whats app------\r\n15.06.2022-jini jugajug koresilen se ekhon ney. notun jini join koresen MD sir er sathe kotha bole janaben', NULL, 'Contacted', '2021-03-18 01:43:34', '2022-06-15 01:50:28'),
(298, 'washim', 'washim.ruphil60@gmail.com', '01720958550', NULL, NULL, NULL, NULL, 'ecommerce website   proposal sent..kaj korai felse\r\n15.06.2022-ekhon ar lagbena', NULL, 'Contacted', '2021-03-18 01:43:41', '2022-06-15 01:34:08'),
(299, 'Unknown', NULL, '01911168767', NULL, NULL, NULL, NULL, 'business website korbe 10k confirmed.. work by others\r\n15.06.2022-software oil tai hosting support korsena. ekhon sobar sathe kotha bole notun kore nibe', NULL, 'Contacted', '2021-03-18 01:43:58', '2022-06-15 01:40:19'),
(300, 'Nafiz sir', NULL, '01765903166', NULL, NULL, NULL, NULL, 'ecommerce website then app---need to call him 25 march(not received). 15 din por call dite hobe. busy\r\n15.06.2022-ecommarce er website banate cheyesilo ekhon sey chinta theke sore asse.', NULL, 'Contacted', '2021-03-18 01:44:24', '2022-06-15 01:47:21'),
(301, 'unknown', NULL, '01934382420', NULL, NULL, NULL, NULL, 'ecommerce website shahadat office visit kore gese.. partner er sthe kotha bole then janabe....\r\n01.06.2022 Number off\r\n15.06.2022-off', NULL, 'Disqualified', '2021-03-18 01:44:40', '2022-06-15 01:32:40'),
(302, 'Unknown', NULL, '01974230111', NULL, NULL, NULL, NULL, 'nc express tourism api\r\n01.06.2022 Call receive korsena\r\n15.06.2022-Call receive korsena ,kete dey bar bar', NULL, 'Disqualified', '2021-03-18 01:44:47', '2022-06-15 01:19:29'),
(303, 'ashadduzzaman asad', NULL, '01717290612', NULL, NULL, NULL, NULL, 'school website korabe online e test nite chay..[not received}\r\n01.06.2022 website baniyese but 3 mas jabot inactive . onno kono service dorkar hoile janabe', NULL, 'Contacted', '2021-03-18 01:45:20', '2022-06-02 04:02:40'),
(304, 'belayat hossain', NULL, '01847092450', NULL, NULL, NULL, NULL, '.basic website korabe asar agge phn korbe business website korabe.  22/03/2021- eid er por korabe', NULL, 'Disqualified', '2021-03-18 01:45:50', '2022-06-16 02:54:43'),
(305, 'azhar uddin bhuiyan', NULL, '01753575569', NULL, NULL, NULL, NULL, 'website design\r\n01.06.2022 onno protisthan theke niyese. tobe jodi onno kono service er proyion hoi janabe', NULL, 'Contacted', '2021-03-18 01:46:14', '2022-06-02 03:57:49'),
(306, 'unknown', NULL, '01920920201', NULL, NULL, NULL, NULL, 'server and website reew korabe ore janabe..\r\n01.06.2022 onno protisthan theke niyese but ekhono active koreni kisudiner moddhe bujjhe nibe.', NULL, 'Contacted', '2021-03-18 01:46:18', '2022-06-02 03:53:01'),
(307, 'Safayet Abedin Ratin', NULL, '01912652587', NULL, NULL, NULL, NULL, 'Deputy Manager IT ACS Textile kensingtondreams.com ecommerce website korabe...Home Decor\r\n01.06.2022 Call receive korsena\r\n15.06.2022-Call receive korsena', NULL, 'Disqualified', '2021-03-18 01:46:39', '2022-06-15 01:17:28'),
(308, 'Jafor Ahmed', 'jafor.irving@gmail.com', '01828022425', NULL, NULL, NULL, NULL, 'BDE https://irving.com.bd/ website redesign korabe  jafor.irving@gmail.com  proposal pathano hoise.. janabe...\r\n01.06.2022 jini jugajug koresilo uni onno protisthane chole aasse tai ar kisu bolte parsena', NULL, 'Disqualified', '2021-03-18 01:47:13', '2022-06-02 03:43:53'),
(309, 'Farsan Hossain    Taqi Chowdhury', NULL, '01745833659', NULL, NULL, NULL, NULL, 'Facebook page cover design plus page setup 2500+ 1000 tk bole disi poore janabe..[no need]\r\n01.06.2022 Call receive korsena\r\n15.06.2022-desher baire chole gese', NULL, 'Contacted', '2021-03-18 01:47:55', '2022-06-15 01:15:44'),
(310, 'farhan', NULL, '0181921745', NULL, '0181921745 , 01874041345 jahid sir', NULL, NULL, 'amader ekhan theke kaj koriye nise\r\n01.06.2022 Vul number', NULL, 'Disqualified', '2021-03-18 01:48:05', '2022-06-02 03:00:35'),
(312, 'unknown', NULL, '01827655150', NULL, NULL, NULL, NULL, 'blog website korabe... proposal pathaisi.. 11min kotha bolsi... sathe fb ads er proposal o pathaisi...Phone not reciveed. if need he will call me\r\n01.06.2022 Number off', NULL, 'Contacted', '2021-03-18 01:49:03', '2022-06-02 02:47:15'),
(313, 'Syed Ekram Shibly', 'syedshibly4@gmail.com', '01685671172', NULL, NULL, NULL, NULL, 'Syed Ekram Shibly Indian Oil Corporation Bangladesh Representative Office  syedshibly4@gmail.com proposal and demo sent already...[proposal sent][when need he will call us]. if need he will call me', NULL, 'Disqualified', '2021-03-18 01:49:28', '2022-06-05 03:50:38'),
(314, 'miraz uddin', 'mondiul786@gmail.com', '01768788045', NULL, NULL, NULL, NULL, 'east rampura thake business website korate chay mondiul786@gmail.com', NULL, 'Disqualified', '2021-03-18 01:49:45', '2022-06-15 05:29:26'),
(315, 'md firoz alam', 'mdfirozalamshikder6565@gmail.com', '01811857434', NULL, NULL, NULL, NULL, 'mdfirozalamshikder6565@gmail.com   buying house website korabe... proposal sent already...[numbr off]\r\n01.06.2022 Number ta off', NULL, 'Disqualified', '2021-03-18 01:50:01', '2022-06-02 02:44:34'),
(316, 'unknown', NULL, '01814703432', NULL, NULL, NULL, NULL, 'business website korae..number off', NULL, 'Disqualified', '2021-03-18 01:50:16', '2022-06-04 21:55:47'),
(317, 'shishir paul', 'shishirpaul971@gmail.com', '01715023039', NULL, NULL, NULL, NULL, 'owner of muktagacha monda shishirpaul971@gmail.com\r\n01.06.2022 vul kore amader ke knock koresilo.uni asole freelancing sikhte chai kono website banabena.', NULL, 'Disqualified', '2021-03-18 01:50:56', '2022-06-02 02:39:17'),
(318, 'Amin', 'evangelarchitectbd@gmail.com', '01796886388', NULL, NULL, NULL, NULL, 'prooposal pathate hobe.. email adress pathabe.... / 22/03/2021- Proposal send. work done', NULL, 'Converted to Customer', '2021-03-18 01:51:01', '2021-03-22 18:04:38'),
(319, 'rakib', NULL, '01709145578', NULL, NULL, NULL, NULL, 'ecommerce website korabe proposal pathano hoise.\r\n01.06.2022-Clint bolse website er bepare se kotha boleni kokhono ,tarto website lagbena.', NULL, 'Disqualified', '2021-03-18 01:51:25', '2022-06-02 02:34:13'),
(320, 'unknown', 'misuk.ahammed@3ilogistics.com', '01971765432', NULL, NULL, NULL, NULL, 'ecommerce website korate chay...  md sir er sathe meeting korte chay.... not interested. 01844185261 tanvir\r\n01.06.2022 aager protisthane ekhon job korsena. tai janena website tara niyese kina', NULL, 'Contacted', '2021-03-18 01:52:06', '2022-06-05 04:28:25'),
(321, 'Unknown', NULL, '01711105228', NULL, NULL, NULL, NULL, 'Limon Realstate company website korabe 24 tarikh er modhe delivery lagbe tai demo and proposal sent already... --- Banano hoye gese\r\n 01-06-2022 koto tarikh tar sathe kotha hoyesilo seta janiye janate hobe .tarpor kotha bolbe\r\n15.06.2022-call korte mana korese', NULL, 'Disqualified', '2021-03-18 01:52:10', '2022-06-15 01:13:11'),
(322, 'Mizanur Rahaman', 'mizanurcse1452@gmail.com', '01749969029', 'raihantfp@gmail.com', NULL, 'TFP Solution Bangladesh', NULL, 'E-commerce/ BuySell Website[number off]\r\n01-06-2022 website onno protisthan theke niyese but chasse eksathe 43k manush hit korle jeno problem na hoi .setar jonno 3rd party er help', NULL, 'Contacted', '2021-03-18 01:52:46', '2022-06-01 23:28:13'),
(323, 'Sujan khan', NULL, '01675932586', NULL, NULL, NULL, NULL, 'Sujan khan website desin korabe.[done,,not \r\n 01-06-2022 -onno company theke niyese tobe amader onnanno service gulo dekhte chai. whatsapp a pathate hobe', NULL, 'Contacted', '2021-03-18 01:53:32', '2022-06-01 22:47:23'),
(324, 'nafiz fuad', 'nafis06fuad@gmail.com', '01533572001', NULL, NULL, 'Gallery Bangladesh', '1/28-5 Nijhum Residential Area', 'ecommerce korae office ashbe..  office e ashce multivendor korbe... 60k janabe pore...Work with Us.', NULL, 'Converted to Customer', '2021-03-18 01:53:48', '2021-07-08 05:56:42'),
(325, 'Unknown', NULL, '01838400750', NULL, NULL, NULL, NULL, 'Erp apps.(need to call him 9 tarikh) he will come in our office. busy', NULL, 'Contacted', '2021-03-18 01:54:00', '2022-06-01 22:42:49'),
(326, 'mamun mattabar', NULL, '01711548041', NULL, NULL, NULL, NULL, 'laravel ecommerce website pore kotha bolbe after eid', NULL, 'Contacted', '2021-03-18 01:54:14', '2022-06-04 04:16:51'),
(327, 'mehedi mb', 'mh_asif01@yahoo.com', '01831119863', NULL, NULL, NULL, NULL, 'traders  Asif    domain: airh2h.com   website and mobile app create korbe...kaj onno jaigai diye dise...if he need he will call us.\r\n15.06.2022-amra naki apps korte chainai ,jar karone onno jaiga theke koresen.', NULL, 'Contacted', '2021-03-18 01:54:29', '2022-06-15 01:12:11'),
(328, 'rashed', NULL, '01717648989', NULL, NULL, NULL, NULL, 'apu website desihn 10 almost confirm. if need he will call me\r\n 01-06-2022 ekhon apatoto website niye kaj korsenna. jokhon korte chaiben obossoy amader ke diye koraben', NULL, 'Contacted', '2021-03-18 01:54:40', '2022-06-01 22:09:24'),
(329, 'ziaul haque', 'threadxstitchdream@gmail.com', '01913804938', NULL, NULL, NULL, NULL, 'pintu@threadxbd.com threadxstitchdream@gmail.com ecommerce website and mobile apps korabe proposal pathano hoise..[done..if he need he will call us.]\r\n 01-06-2022 Call receive korsena\r\n15.06.2022-ekhon ar proyiojon nai', NULL, 'Contacted', '2021-03-18 01:55:15', '2022-06-15 01:08:11'),
(330, 'unknown', NULL, '01975559853', NULL, NULL, NULL, NULL, 'website desihn korabe. nummber off. number off. phone  off\r\n01-02-2022-number off kore rekhese', NULL, 'Disqualified', '2021-03-18 01:55:25', '2022-06-01 21:55:30'),
(331, 'hamidur', NULL, '01711532449', NULL, NULL, NULL, NULL, 'facebook ads package nnibe.\r\n01-02-2022-website inactive ase tai ,facebook ads dorkar nai.', NULL, 'Contacted', '2021-03-18 01:55:57', '2022-06-01 21:53:47'),
(332, 'al fahad', NULL, '01686728394', NULL, NULL, NULL, NULL, 'website done', NULL, 'Disqualified', '2021-03-18 01:56:29', '2022-06-04 23:05:55'),
(333, 'delwar', NULL, '01951177516', NULL, NULL, NULL, NULL, 'colab raintree delwar food brand er jonno website korabe.. sathe seo and graphics design korabe...done..if he need he will call us.\r\n01-02-2022-call receive korsena\r\n15.06.2022-kono website lagbena', NULL, 'Disqualified', '2021-03-18 01:56:44', '2022-06-15 01:06:02'),
(334, 'tania', NULL, '01755544167', NULL, NULL, NULL, NULL, 'MPC called for software development..\r\n01-02-2022-Number Off\r\n15.06.2022-kew bolte parsena kisu.je madam jugajug koresilo se 5 bosor age job serediyese', NULL, 'Disqualified', '2021-03-18 01:57:20', '2022-06-15 01:02:05'),
(335, 'Sheam', NULL, '01701688601', NULL, NULL, NULL, NULL, 'Ecommerce website proposal sent... rongpur teke office ashbe.[not need now] \r\n05.06.2022- Diver niye ekta website khulte chai .jekhane knock kore diver pawa jabe', NULL, 'Contacted', '2021-03-18 01:57:48', '2022-06-05 03:01:22'),
(336, 'nuruzzaman', 'nuruzzaman_001@yahoo.com', '01914984785', NULL, NULL, NULL, NULL, 'NewsPortal/ Newspaper Website  15000 TK - 20000 TK   pore janabe. 21/03/2021 -- interested for seo. if need he will call me.', NULL, 'Qualified', '2021-03-18 01:58:04', '2022-06-05 03:50:16'),
(337, 'farhana', 'farhana@prime-insurance.net', '01794116503', NULL, NULL, NULL, NULL, 'prime insurance  business website proposal sent korte hobe... farhana@prime-insurance.net ---[done from anoher place]\r\n01-02-2022-onno company theke website niyese & sey company sob doroner support disse.', NULL, 'Contacted', '2021-03-18 01:58:33', '2022-06-01 21:42:22'),
(338, 'ashraful', 'ashrafulhoque003@gmail.com', '01675846336', NULL, NULL, NULL, NULL, 'E-commerce/ BuySell Website   Less Than 10000 TK. Phone not recived korbe na\r\n01-02-2022-Domain kina ase amader kas theke ,ekhon kisu somossar jonno website korsena.kisu somoy lagbe', NULL, 'Contacted', '2021-03-18 01:58:47', '2022-06-01 21:36:17'),
(339, 'oudidur rahman', 'mtouhid1971@gmail.com', '01794342424', NULL, NULL, NULL, NULL, 'mtouhid1971@gmail.com  https://futureexpressisp.blogspot.com/ mtouhid toudidur rahman ujjol bishas blogspot website theke wordpress e convert korbe and new design korbe.... corporate informative website hobe...[not need now]\r\n01-02-2022-bar bar call kete disse', NULL, 'Contacted', '2021-03-18 01:59:26', '2022-06-01 21:29:42'),
(340, 'Harunur Rashid', 'hrashid_bd@outlook.com', '01819465270', NULL, NULL, 'Aviation.com.bd', 'Navana Johura Square 22,Mymensingh road, Dhaka', 'Corporate/ Company Website   10000 TK - 15000 TK.  Work with us.', NULL, 'Converted to Customer', '2021-03-18 01:59:28', '2021-07-08 05:50:10'),
(341, 'Wadud', 'abdulwadud989@gmail.com', '01709516316', NULL, NULL, NULL, NULL, 'abdulwadud989@gmail.com    business website design .... [numbber off]\r\n01-02-2022-Number off thake sob somoy', NULL, 'Disqualified', '2021-03-18 02:00:00', '2022-06-01 21:24:39'),
(342, 'obaidul', 'obaidul.dpi@gmail.com', '01785768679', NULL, NULL, NULL, NULL, '-- parfect packaging ltd. -- company website banabe -- gazipur -- proposal and sample website sent[osusto,lagle call dibe]', NULL, 'Disqualified', '2021-03-18 02:00:44', '2022-06-15 04:26:36'),
(343, 'unknown', 'alaminfarazi@gmail.com', '01912679289', NULL, NULL, NULL, NULL, 'al amin iub website design p4  alaminfarazi@gmail.com  proposal sent. 21/03/21 work done by others  company, not need\r\n01-06-2022 office a meeting korse. ses kore kotha bolbe', NULL, 'Contacted', '2021-03-18 02:00:44', '2022-06-01 21:20:53'),
(344, 'Unknown', NULL, '01626676045', NULL, NULL, NULL, NULL, 'DATABASE MANAGEMENT SYSTEM - personal paitance ar jonne - imran --- uni bade ar keo dekhbe na.', NULL, 'Disqualified', '2021-03-18 02:01:06', '2022-06-04 01:21:25'),
(345, 'Engr Syed Hasan Expert Group', 'eeicbd@gmail.com', '01717672242', NULL, NULL, NULL, NULL, 'business website design poragst@gmail.com cc: eeicbd@gmail.com   proposal sent. website make with others . i knock him g suite', NULL, 'Disqualified', '2021-03-18 02:01:26', '2022-06-16 03:02:15'),
(346, 'Unknown', 'shahrior.kabir94@gmail.com', '01747445733', NULL, '0257164480', NULL, NULL, 'Company: website new electric -- 158 nowabpur   --  sob kisu ok hole payment diye dibe --[need to call next month 1st weak]. next week call him. Eid er por kaj korbe', NULL, 'Disqualified', '2021-03-18 02:01:52', '2022-06-05 02:00:13'),
(347, 'Kamel Biswas', 'contact@kamelbiswas.com', '01744529630', NULL, NULL, NULL, NULL, 'SEO proposal sent contact@kamelbiswas.com\r\n01-02-2022-onno protisthan theke niyese.apatoto kisu lagbena ,majhe majhe phone dewa hoi.kono help dorkar hoile nischoy janaben.tai ar phone na dile valo hoi bolese.', NULL, 'Disqualified', '2021-03-18 02:02:21', '2022-06-01 21:13:39'),
(348, 'Course Enroll 05/06/2022', 'ittext940.bd@gmail.com', '01623301572', NULL, NULL, NULL, NULL, 'online e course enroll website korabe then people online e course buy korbe and watch online... 30000tk bolben..  p3 or 4 nite hobe... Raat e Call Korbe..', NULL, 'Contacted', '2021-03-18 02:02:27', '2022-06-04 22:24:18'),
(349, 'Rony', NULL, '01819399577', NULL, NULL, NULL, NULL, 'Uttra business website design korabe proposal sent...-(not  talking)...Phone off', NULL, 'Disqualified', '2021-03-18 02:02:50', '2022-06-16 00:47:58'),
(350, 'ayesha', 'ayeshanigar6@gmail.com', '01816350031', NULL, NULL, NULL, NULL, 'eliance shipping multivendor website       ---------------------------- next week sunday phn korbe......21/03/2021 not interested\r\n01-02-2022-apatoto stop rekhese , abar jokhon korbe amader kas thekey korbe.', NULL, 'Contacted', '2021-03-18 02:03:10', '2022-06-01 21:04:49'),
(351, 'Reza Tanvir', 'reza.tanvir02@gmail.com', '01670735611', NULL, NULL, NULL, NULL, 'House: 17, Road: 33, Pallabi, Dhaka   reza.tanvir02@gmail.com  .If he need any service .He will call us.', NULL, 'Disqualified', '2021-03-18 02:03:29', '2022-06-15 04:28:01'),
(352, 'Rony', 'hotovaga451046@gmail.com', '01774446494', NULL, NULL, NULL, NULL, 'Ecommerce website design kkorabe..[he need  another website.He will call us.When it need}', NULL, 'Disqualified', '2021-03-18 02:04:12', '2022-06-15 04:20:56'),
(353, 'mithun', 'mithun@microtradegroup.com', '01867460396', NULL, NULL, NULL, NULL, 'business website pore contact ekhn o order pay nai.. janabe...\r\n21/10/2020.  ... 22/03/2021--- If need he will call me no response\r\n05.06.2022-ekhon korbena but ekhn theke nio mito jugajug kore jabe .onk kisu somporke jante thakbe .tarpor korbe. accounts related website banate chai. \r\n02-06-2022-Call Receive korsena.', NULL, 'Contacted', '2021-03-18 02:04:13', '2022-06-05 02:26:09'),
(354, 'unknown', 'marriagesolutionbd@gmmail.com', '01308244295', NULL, NULL, NULL, NULL, 'number invalid', NULL, 'Disqualified', '2021-03-18 02:04:36', '2022-06-01 06:00:02'),
(355, 'BHUIYAN MD MASUM', 'mdmasumbhuiyan@gmail.com', '01785831387', NULL, NULL, NULL, NULL, 'need to send him Proposal....H  ask.mdmasumbhuiyan@gmail.com  Corporate/ Company Website  30000 TK - 50000 TK...work done by others .', NULL, 'Disqualified', '2021-03-18 02:04:46', '2022-06-15 03:24:18'),
(356, 'hanif kamal', NULL, '01921347043', NULL, NULL, NULL, NULL, 'garments business website...done not need now anything', NULL, 'Disqualified', '2021-03-18 02:05:54', '2022-06-06 05:47:19'),
(357, 'Kamrul', 'kamrulislam.k2019@gmail.com', '01743527411', NULL, NULL, NULL, NULL, 'mail address pathabe then proposal pathate hobe -------------   business website 2 nibe invoice pathano hoise..---------------------------------------------\r\n24/10/2020', NULL, 'Converted to Customer', '2021-03-18 02:05:55', '2021-07-07 08:35:49'),
(358, 'rabbani', 'mgr.abbbd@gmail.com', '01678011127', NULL, NULL, NULL, NULL, 'business website p2 korabe... 15k fixed..but ekhn domain hosting er tk dibe pore baki tk dibe...------------------ confirm  ---- number not in service', NULL, 'Disqualified', '2021-03-18 02:06:54', '2022-06-04 22:25:13'),
(359, 'masudur rahman', NULL, '01718360657', NULL, NULL, NULL, NULL, 'grand nawab   restaurent er jonno website design korbe...  unicornbd@gmail.com business website korabe.. demo and proposal already sent korsi..after eid', NULL, 'Contacted', '2021-03-19 04:17:27', '2022-06-16 02:53:42'),
(360, 'asif munim', NULL, '01719359827', NULL, NULL, NULL, NULL, 'business informative website korabe 12k bolsi pore janabe.. 21/03/2021', NULL, 'Disqualified', '2021-03-19 04:19:55', '2022-06-15 05:58:08'),
(361, 'Arefin', 'arefin.farabi@gmail.com', '01971051997', 'Noorzina.prome@gmail.com', '01312131453', NULL, NULL, 'lucky builders  er website design korabe email pathabe.. thn proposal sent... number not in service,\r\n01-06-22 number off', NULL, 'Disqualified', '2021-03-19 04:22:58', '2022-06-01 05:59:16'),
(362, 'Farzana', NULL, '01302689369', NULL, NULL, NULL, NULL, 'ecommerce website korabe 15k covid package.. number off', NULL, 'Disqualified', '2021-03-19 04:24:00', '2022-06-18 04:29:20'),
(363, 'Lutfar Dhali', NULL, '01703939777', NULL, NULL, NULL, NULL, 'Nochimon panorama documentary  office ashce then 11k fixed.. proposal niye gese.-----------  \r\nnumber off\r\n28/10/2020', NULL, 'Disqualified', '2021-03-19 04:25:06', '2022-06-05 02:58:16'),
(364, 'saikat', 'nfsforbd@gmail.com', '01707011669', NULL, NULL, NULL, NULL, 'informative business website... prposal sent .... 21/03/2021. Busy', NULL, 'Disqualified', '2021-03-19 04:26:33', '2022-06-15 04:50:00'),
(365, 'Amit Debnath', 'amitdebnath.31@gmail.com', '01754636797', NULL, NULL, NULL, NULL, 'garment website proposal sent and gsuite sent demo link sent.... ------------------------------------------\r\n number off\r\n29/10/2020', NULL, 'Disqualified', '2021-03-19 04:45:02', '2022-06-05 04:17:41'),
(366, 'babby zahidul', 'zahiddiu250@gmail.com', '01575186624', NULL, NULL, NULL, NULL, 'book sell korbe ecommerce website office e meeting kore gese....------  2-3 din por \r\njanabe...number off\r\n01-06-22 number off', NULL, 'Disqualified', '2021-03-19 04:47:14', '2022-06-01 05:57:23'),
(367, 'mehedi sojol', NULL, '01707008328', NULL, NULL, NULL, NULL, 'website design next week phn... 21/03/2021---pore khota \r\n--          ,            ', NULL, 'Contacted', '2021-03-19 04:48:35', '2022-06-01 05:50:29'),
(368, 'Unknown', 'ruksanakadir13@gmail.com', '01703991881', NULL, NULL, NULL, NULL, 'ksana kadir   COO  dahmashi corporation   ecommerce website proposal sent ..-----website done', NULL, 'Disqualified', '2021-03-19 04:49:49', '2022-06-04 23:05:24'),
(369, 'Unknown', NULL, '01319344949', NULL, NULL, NULL, NULL, 'website new hosting e transfer korbe... oni hosting kine dibe amra migrate kore dibo... php te website kora.. https://www.aarte.com.bd/ no response', NULL, 'Disqualified', '2021-03-19 04:50:24', '2022-06-03 23:38:08'),
(370, 'Abdullah-Al-Shafi', NULL, '01611620720', NULL, NULL, NULL, NULL, 'n.zcompany@yahoo.com  dynamic basic website with cpanel or CMS. 10k fixed... proposal sent already....-----22/03/2021-- if need he will call me. pore janbe', NULL, 'Disqualified', '2021-03-19 04:50:50', '2022-06-05 02:01:31'),
(371, 'Raju Ahmed', 'bizline.raju@gmail.com', '01676346318', NULL, NULL, NULL, NULL, 'Website design business proposal sent.. bizline.raju@gmail.com ---- ---- ----  sunday or onay asbe...\r\ninterested. next time call him. number off', NULL, 'Disqualified', '2021-03-19 04:51:26', '2022-06-15 03:29:02'),
(372, 'moinul islam', 'moinulpatoary@gmail.com', '01886204086', NULL, NULL, NULL, NULL, 'jhenaidah  moinulpatoary@gmail.com   exm site lazada.com.my   exm site dekhe then proposal patho... 21/03/2021 - send proposal .num \r\n-- website         ', NULL, 'Contacted', '2021-03-19 04:52:24', '2022-06-01 05:21:12'),
(373, 'Unknown', 'info@megatechdhaka.com', '01534303674', NULL, NULL, NULL, NULL, 'House: 16, Road: 140, apt A2, Behind old pizza hut gulshan 1,    business wwebsite proposal sent already...birokto hocche', NULL, 'Disqualified', '2021-03-19 04:53:06', '2022-06-03 23:37:41'),
(374, 'Unknown', 'tanvir.scholarszone@gmail.com', '01714076481', NULL, NULL, NULL, NULL, 'ecommerce website design korabbe... number \r\n--  \r\n05.06.2022-Number Off thake', NULL, 'Disqualified', '2021-03-19 04:55:28', '2022-06-05 02:00:37'),
(375, 'Unknown', NULL, '01401122221', NULL, NULL, NULL, NULL, 'banasree mobile apps banate chay.. setate screenshort upload korbe.. num off', NULL, 'Disqualified', '2021-03-19 04:56:53', '2022-06-03 23:37:25'),
(376, 'maeesha mitul', NULL, '01408485369', NULL, NULL, NULL, NULL, 'ecommerce website korabe .... laravel..number off', NULL, 'Disqualified', '2021-03-19 04:57:42', '2022-06-15 03:30:53'),
(377, 'Abdur Tutul', NULL, '01787662386', NULL, NULL, NULL, NULL, 'Municipal Association of Bangladesh-MAB!  mab.org.bd Redesign korte hobe...no \r\n\r\n--,             ', NULL, 'Contacted', '2021-03-19 04:58:26', '2022-06-01 05:09:46'),
(378, 'rafi bokhari', 'rafi.bokhari@gmail.com', '01742568655', NULL, NULL, NULL, NULL, 'website design korabe... zafar. 22/03/2021-- Tar MD r shate khota bole janabe', NULL, 'Disqualified', '2021-03-19 04:59:37', '2022-06-15 04:24:07'),
(379, 'Unknown', 'chair.patronas@gmail.com', '01777666600', NULL, NULL, NULL, NULL, 'news portal korabe... amader basic proposal pathano hoise... dhaka sena nibash thake... \r\nonar kach theke detail requirement niye then kaj done korte hobe.... no \r\n--   \r\n09/01/21 uni jevabe korate chasse ,thik oivabe hossena . bananite ekta group kaj korse .but bujhanur por amader ke diye dekhte chai .ekhon meeting a 1 hour por call korte hobe .', NULL, 'Contacted', '2021-03-19 05:41:21', '2022-06-05 01:48:48'),
(380, 'Raysa Jashim', 'raysa@innoweb.co', '01776535644', NULL, NULL, NULL, NULL, 'Require Company Website for a Software development company. Want the look of the website to be like www.newscred.com  budget 20000tk   oni amader website e contact korse.. kotha bole then detail requiement nen then quote koren.. website kora hoise', NULL, 'Disqualified', '2021-03-19 05:42:14', '2022-06-05 04:17:27'),
(381, 'Rakib Ahmed dis', NULL, '01672073070', NULL, NULL, NULL, NULL, 'rakib@itn-buet.org  We have needed to redesign https://itn.buet.ac.bd/web/ ourwebsite like the website offering similar functionalities mentioned below:  https://www.sei.org/     buet er website agbe jeta demo dise same to same...call tomorrow', NULL, 'Disqualified', '2021-03-19 05:43:12', '2022-06-17 21:36:00'),
(382, 'shahajan alam', 'iamkhandhaka@yahoo.com', '01972726068', NULL, NULL, NULL, NULL, 'one blog site and one ecommerce website design korbe.... email text korbe proposal pathate hobe.... number off\r\n05.06.2022-Number off', NULL, 'Contacted', '2021-03-19 05:43:46', '2022-06-05 02:27:49'),
(383, 'Nahid Ahmed', 'nahidahammed000@gmail.com', '01636696632', NULL, NULL, NULL, NULL, 'Clipping Path er website korabe...      prposal pathiye followup korte hobe..  amader kora demo website eta dekhaben.. http://photoexpertsbd.com/. not response number off', NULL, 'Disqualified', '2021-03-19 05:44:35', '2022-06-01 04:06:31'),
(384, 'Unknown', NULL, '01708408898', NULL, NULL, NULL, NULL, 'Nafees Shop  website design korabe... number off', NULL, 'Disqualified', '2021-03-19 05:45:15', '2022-06-03 23:37:09'),
(385, 'Jahir Uddin Shamim', NULL, '01515652791', NULL, NULL, NULL, NULL, 'IT Officer Reaching People in Need (RPN) We need an attractive website. Accounts Software:including   Accounts Management Soft. Job chere dise, akhon ar lagbe na.\r\n--            ', NULL, 'Disqualified', '2021-03-19 05:46:26', '2022-06-01 04:05:29'),
(386, 'Shah Alam', NULL, '01819454892', NULL, NULL, NULL, NULL, 'Website Design, 20/03/2021 interested . Dont call him.  if need he will call me', NULL, 'Disqualified', '2021-03-19 05:48:30', '2022-06-01 04:12:06'),
(387, 'Unknown', NULL, '01952671935', NULL, NULL, NULL, NULL, 'website design. work done with others comapnay. \r\n--,    ', NULL, 'Disqualified', '2021-03-19 05:48:50', '2022-06-01 05:20:26'),
(388, 'Abdur Barik', NULL, '01792807782', NULL, NULL, NULL, NULL, 'Website design Fb number \r\n--   \r\n05.06.2022-Mobile Off', NULL, 'Disqualified', '2021-03-19 05:49:25', '2022-06-05 01:36:55'),
(389, 'Unknown', NULL, '01886662926', NULL, NULL, NULL, NULL, 'Swing Chair Bangladesh number \r\n--  ', NULL, 'Disqualified', '2021-03-19 05:50:09', '2022-06-01 03:58:14'),
